job_id,titles,teasers,companies,locations,categorys,subCategories,job_types,salaries,dateposted,datedisplay,url
75375824,"Manager, SIT Teaching and Learning Academy (Data Analytics)",-,Singapore Institute of Technology,Central Region,Information & Communication Technology,Database Development & Administration,Full time,,2024-04-24 04:02:19,8h ago,https://www.jobstreet.com.sg/job/75375824
75386609,"Senior/ Analyst, Data Science, Group Finance Analytics (Contract)","You will champion the development of new data science techniques, methodologies and delivery of analytics projects.",Singapore Health Services Pte Ltd (SingHealth HQ),Central Region,Science & Technology,"Mathematics, Statistics & Information Sciences",Contract/Temp,,2024-04-24 09:25:01,3h ago,https://www.jobstreet.com.sg/job/75386609
75367548,"Senior Data Analyst, O&T Quality Assurance - Innovation and Analytics (AVP/C12)","The O&T Quality Assurance (QA) in O&T s COO function and is responsible to provide strong oversight, facilitate reviews and support Citi s effectiv...",Citibank N.A.,Central Region,Information & Communication Technology,Testing & Quality Assurance,Full time,,2024-04-23 16:55:00,19h ago,https://www.jobstreet.com.sg/job/75367548
75321199,"Data Analyst - Marketing Analytics, Regional Brand & Growth Marketing",-,SHOPEE SINGAPORE PRIVATE LIMITED,Central Region,Marketing & Communications,Marketing Communications,Full time,,2024-04-22 07:53:08,2d ago,https://www.jobstreet.com.sg/job/75321199
75339613,"Manager, Group Care Plan Operations, Data Analytics & Insights(6318)",-,NUHS Group Ops & IT,Central Region,Marketing & Communications,Market Research & Analysis,Full time,,2024-04-23 02:14:32,1d ago,https://www.jobstreet.com.sg/job/75339613
75380977,Lecturer/Diploma in Big Data & Analytics,"Lecturer in School of Informatics & IT (Diploma in Big Data & Analytics)
[What you will be working on]
  Conduct lessons and carry out all relevant...",Public Service Division,Central Region,Education & Training,Teaching - Tertiary,Full time,,2024-04-24 02:31:00,10h ago,https://www.jobstreet.com.sg/job/75380977
75368539,"Intern, Data Analytics, Disney+ - Jul to Dec 2024","The Data Analytics Intern supports the teams in all analytics functions behind all user growth initiatives and help monitor and optimize program, c...",The Walt Disney Company (APAC),Central Region,Marketing & Communications,Marketing Communications,Full time,,2024-04-23 12:12:00,1d ago,https://www.jobstreet.com.sg/job/75368539
75386522,"Principal Analyst, Group Finance Analytics","You will provide technical advisory to the analysts, establishing data analytics support.",Singapore Health Services Pte Ltd (SingHealth HQ),Central Region,Science & Technology,"Mathematics, Statistics & Information Sciences",Full time,,2024-04-24 09:24:02,3h ago,https://www.jobstreet.com.sg/job/75386522
75340009,Data Analyst,"Unleash insights as a Data Analyst! Dive into data, drive decisions, and fuel innovation with us. Join now!",NEO GARDEN CATERING PTE. LTD.,West Region,Science & Technology,"Mathematics, Statistics & Information Sciences",Full time,,2024-04-23 02:26:32,1d ago,https://www.jobstreet.com.sg/job/75340009
75344816,Business Risk Specialist  Data Analytics & Sampling - Singapore,You'll be working in the Wealth Management Asia Pacific (WM APAC) Regional Business Risk Organization Control Framework Team. We support the WM APAC,Hays Specialist Recruitment Pte Ltd,Central Region,Banking & Financial Services,Banking - Corporate & Institutional,Contract/Temp,$5000.0 - $10000.0 per month + Attractive salary & care,2024-04-23 04:20:31,1d ago,https://www.jobstreet.com.sg/job/75344816
75302666,Information Technology - Senior Data Engineer (Analytics Engineering Track),"We have multiple senior data engineering positions available. The Data Analytics Engineer is responsible for designing and developing robust, scala...",Singapore Airlines,East Region,Science & Technology,"Mathematics, Statistics & Information Sciences",Full time,,2024-04-21 14:39:00,2d ago,https://www.jobstreet.com.sg/job/75302666
75367936,Data Analyst,"4e Exchange, a leading financial derivatives trading platform, is seeking a Senior Data Analyst to join our team. As a global leader in the financi...",4e,Central Region,Banking & Financial Services,Analysis & Reporting,Full time,,2024-04-23 13:13:00,23h ago,https://www.jobstreet.com.sg/job/75367936
75332524,Data Analyst,"Job Description: As a Data Analyst, you will play a crucial role in leveraging data to drive business insights and decision-making. Your primary re...",JCO ANALYTICS PTE. LTD.,Central Region,Science & Technology,"Mathematics, Statistics & Information Sciences",Contract/Temp,,2024-04-22 14:15:00,1d ago,https://www.jobstreet.com.sg/job/75332524
75354759,Data Analyst (Phillip Nova),"Proficiency in data manipulation and analysis tools. Strong data visualization skills using tools such as Tableau, Power BI, or others.",Phillip Nova Pte Ltd,Central Region,Science & Technology,"Mathematics, Statistics & Information Sciences",Full time,,2024-04-23 10:04:26,1d ago,https://www.jobstreet.com.sg/job/75354759
75355995,HR Dashboard & Analytics Executive | Up to $3500 | 6 months,-,PERSOLKELLY Singapore Pte Ltd (Formerly Kelly Services Singapore Pte Ltd),Central Region,Human Resources & Recruitment,Organisational Development,Contract/Temp,"$3,000 – $3,500 per month",2024-04-23 13:50:37,23h ago,https://www.jobstreet.com.sg/job/75355995
75383958,"Senior VP, Lead TDM, Platform Engineering, Data Analytics Technology",-,United Overseas Bank Limited (UOB),Central Region,Information & Communication Technology,Engineering - Software,Full time,,2024-04-24 07:57:28,4h ago,https://www.jobstreet.com.sg/job/75383958
75329590,"VP, Financial Strategy (Data Analytics, Programming), Group Finance",We support enhanced decision-making to achieve optimal and sustainable financial outcomes for our shareholders. We are responsible for providing in...,United Overseas Bank Limited (UOB),Central Region,Banking & Financial Services,Analysis & Reporting,Full time,,2024-04-22 12:59:00,1d ago,https://www.jobstreet.com.sg/job/75329590
75319768,Data Analyst,You will be given good learning exposure.,Methodist Welfare Services,West Region,Healthcare & Medical,Clinical/Medical Research,Full time,,2024-04-22 07:05:05,2d ago,https://www.jobstreet.com.sg/job/75319768
75246968,"Data Analytics Intern - Business Intelligence, Regional Operations",-,SHOPEE SINGAPORE PRIVATE LIMITED,Central Region,Information & Communication Technology,Business/Systems Analysts,Full time,,2024-04-19 01:42:39,5d ago,https://www.jobstreet.com.sg/job/75246968
75230897,"Data Analyst Intern - Regional Marketing Analytics, Regional Brand & Growth Mark",-,SHOPEE SINGAPORE PRIVATE LIMITED,Central Region,Marketing & Communications,Market Research & Analysis,Full time,,2024-04-18 08:38:37,6d ago,https://www.jobstreet.com.sg/job/75230897
75252891,"Data Analytics Lead, Regional Business Intelligence & Planning",--,SHOPEE SINGAPORE PRIVATE LIMITED,Central Region,Information & Communication Technology,Business/Systems Analysts,Full time,,2024-04-19 02:57:09,5d ago,https://www.jobstreet.com.sg/job/75252891
75239580,Data Analytics Audit Specialist,"Develop and implement data analytics strategies to enhance audit procedures and methodologies, incorporating emerging technologies and best practic...",Central Provident Fund Board,Central Region,Accounting,Audit - Internal,Contract/Temp,,2024-04-18 14:50:00,5d ago,https://www.jobstreet.com.sg/job/75239580
75367912,Manager / Assistant Senior Manager (Data Analytics),"As a data analyst in our Internal Audit Team, you are involved in the design and performance of data analytics tests to support OIA s continuous mo...",Yale-NUS College,Central Region,Banking & Financial Services,Analysis & Reporting,Full time,,2024-04-18 12:00:00,6d ago,https://www.jobstreet.com.sg/job/75367912
75328756,HR Dashboard & Analytics Executive | Up to $3500 | 6 months (renewable),-,PERSOLKELLY Singapore Pte Ltd (Formerly Kelly Services Singapore Pte Ltd),Central Region,Human Resources & Recruitment,Other,Contract/Temp,"$3,000 – $3,500 per month",2024-04-22 15:26:17,1d ago,https://www.jobstreet.com.sg/job/75328756
75272900,Strategy and Operations Data Analytics Intern - Shopee Xpress Last Mile,"The Operation teams at Shopee covers the operational end-to-end process, from when the buyer searches for a product listed on the Shopee platform...",SHOPEE SINGAPORE PRIVATE LIMITED,Singapore,Information & Communication Technology,Business/Systems Analysts,Contract/Temp,,2024-04-19 07:39:07,5d ago,https://www.jobstreet.com.sg/job/75272900
75227200,Analytics Developer/Data Engineer,"2. What we are looking for
  Good understanding and completion of projects using waterfall/Agile methodology.
  Strong SQL, data modelling and data...",PHOENIX SOLUTIONS (S) PTE. LTD.,East Region,Information & Communication Technology,Engineering - Software,Full time,,2024-04-18 02:42:00,6d ago,https://www.jobstreet.com.sg/job/75227200
75207576,Administrator (Data Analytics),"Interested to explore into Data Analytics function
Organized and meticulous to assist team on administration",IHH Healthcare,Central Region,Administration & Office Support,Administrative Assistants,Full time,,2024-04-17 15:55:00,6d ago,https://www.jobstreet.com.sg/job/75207576
75383926,"Manager, Marketing Data Analyst (6412)",-,Changi Airport Group (Singapore) Pte. Ltd.,Central Region,Marketing & Communications,Management,Full time,,2024-04-24 07:56:18,4h ago,https://www.jobstreet.com.sg/job/75383926
75308328,Data Analyst - ShopeePay,-,SHOPEE SINGAPORE PRIVATE LIMITED,Central Region,Information & Communication Technology,Business/Systems Analysts,Full time,,2024-04-22 02:05:55,2d ago,https://www.jobstreet.com.sg/job/75308328
75318241,Data Scientist,"As a Data Scientist, you will be at the forefront of our data analytics efforts, working closely with cross-functional teams to develop and deploy ...",CPO PTE. LTD.,Central Region,Science & Technology,"Mathematics, Statistics & Information Sciences",Full time,,2024-04-22 02:09:00,2d ago,https://www.jobstreet.com.sg/job/75318241
75226861,Data Scientist and Analytics Specialist,"Responsible for enabling decision making by exploring the data, recommending actionable insights, and building visualizations, dashboards.
Packages...",Philips Domestic Appliances Singapore Pte. Ltd.,Central Region,Sales,New Business Development,Full time,,2024-04-18 02:39:00,6d ago,https://www.jobstreet.com.sg/job/75226861
75328324,"HR Dashboard & Analytics Executive (6 months) | Up $3,500","Executive (HR Dashboard and Analytics)	
Chinatown
6 months (w option to extend)",PERSOLKELLY Singapore Pte Ltd (Formerly Kelly Services Singapore Pte Ltd),Central Region,Human Resources & Recruitment,Consulting & Generalist HR,Contract/Temp,"$3,000 – $3,500 per month",2024-04-22 13:43:35,1d ago,https://www.jobstreet.com.sg/job/75328324
75191422,Internship - Data Analytics (BE Industrial Engineering),"Does this sound like just the right challenge for you? If so, we look forward to getting to know you!",Infineon Technologies,Central Region,Information & Communication Technology,Business/Systems Analysts,Contract/Temp,,2024-04-17 05:52:55,7d ago,https://www.jobstreet.com.sg/job/75191422
75341640,Data Architect Analyst (6 months internship),-,"Mizuho Bank, Ltd",Central Region,Information & Communication Technology,Database Development & Administration,Full time,,2024-04-23 03:10:47,1d ago,https://www.jobstreet.com.sg/job/75341640
75191095,"Internship - ATV Supply Chain Planner, Data Analytics","Does this sound like just the right challenge for you? If so, we look forward to getting to know you!",Infineon Technologies,Central Region,Information & Communication Technology,Database Development & Administration,Contract/Temp,,2024-04-17 05:40:47,7d ago,https://www.jobstreet.com.sg/job/75191095
75206179,Data Analyst,"Responsible for delivering, standardizing and automating data analytic reports, notifications and dashboards.
Job Requirements:
Degree in Computer ...",D L Resources Pte Ltd,Central Region,Information & Communication Technology,Business/Systems Analysts,Contract/Temp,,2024-04-17 13:40:00,6d ago,https://www.jobstreet.com.sg/job/75206179
75203101,Data Analyst,"Job Roles:Regular data mining, transformation, visualization, analytics and reporting worksCoordinate with various internal and external technology...",D L Resources Pte Ltd,Singapore,Information & Communication Technology,Business/Systems Analysts,Contract/Temp,,2024-04-17 10:13:54,7d ago,https://www.jobstreet.com.sg/job/75203101
75368930,"AVP, Data Analyst, Business Performance, Consumer Banking Group",Refer a friend Submit a candidate's profile,DBS Bank Limited,Central Region,Accounting,Analysis & Reporting,Full time,,2024-04-23 05:01:00,1d ago,https://www.jobstreet.com.sg/job/75368930
75182689,Administrator (Data Analytics),Data Analysis and prepare reports  Manage calendar for VP and the team Schedule and prepare claims submission,IHH Healthcare,Central Region,Administration & Office Support,Administrative Assistants,Full time,,2024-04-17 01:35:50,7d ago,https://www.jobstreet.com.sg/job/75182689
75238768,Senior Data Analyst,We are seeking an experienced Senior Data Analyst to join our dynamic Data Analytics & Insights team. The ideal candidate will have a solid foundat...,Net6tem,Central Region,Information & Communication Technology,Business/Systems Analysts,Contract/Temp,,2024-04-18 14:52:00,5d ago,https://www.jobstreet.com.sg/job/75238768
75150563,"Senior Executive / Assistant Manager, Data Analytics & Insights(5861)",-,NUHS Group Ops & IT,Central Region,Hospitality & Tourism,Management,Full time,,2024-04-16 02:11:03,8d ago,https://www.jobstreet.com.sg/job/75150563
75320644,Data Science Engineer - (Python),To develop models and work with various in-house stakeholders in the manufacturing industry.,GMP Group HQ,West Region,Information & Communication Technology,Management,Full time,"$4,000 – $4,800 per month",2024-04-22 07:32:53,2d ago,https://www.jobstreet.com.sg/job/75320644
75148974,Administrator (Data Analytics),The Role Key accountabilities Data Analysis and prepare reports  Project Management Manage calendar for VP and the team Schedule and coordin,IHH Healthcare,Central Region,Administration & Office Support,Administrative Assistants,Full time,,2024-04-16 01:21:03,8d ago,https://www.jobstreet.com.sg/job/75148974
75252728,Data Analyst - SeaMoney Credit,-,SHOPEE SINGAPORE PRIVATE LIMITED,Central Region,Banking & Financial Services,Analysis & Reporting,Full time,,2024-04-19 02:52:06,5d ago,https://www.jobstreet.com.sg/job/75252728
75371604,Data Science Analyst / Senior Data Science Analyst,Data Science Analyst / Senior Data Science Analyst,PSA Corporation Limited,Central Region,Science & Technology,"Mathematics, Statistics & Information Sciences",Full time,,2024-04-24 03:20:18,9h ago,https://www.jobstreet.com.sg/job/75371604
75243684,"Data Analyst, Planning & Budgeting - SG Warehouse",The Business Intelligence and Data Analytics team plays a critical role in conducting close-loop data-driven business iterations. As business...,SHOPEE SINGAPORE PRIVATE LIMITED,Singapore,"Manufacturing, Transport & Logistics",Analysis & Reporting,Full time,,2024-04-19 00:54:48,5d ago,https://www.jobstreet.com.sg/job/75243684
75276585,Data Analyst (Data Models| SQL | Cloud Data) - West,"Collaborate with the cross functional teams to comprehend department, individual data requirements, use-case specific.",Talent Trader Group Pte Ltd,Central Region,Information & Communication Technology,Database Development & Administration,Full time,,2024-04-19 08:14:14,5d ago,https://www.jobstreet.com.sg/job/75276585
75242491,Regional Operations Data Analyst,--,SHOPEE SINGAPORE PRIVATE LIMITED,Central Region,Science & Technology,"Mathematics, Statistics & Information Sciences",Full time,,2024-04-19 00:23:25,5d ago,https://www.jobstreet.com.sg/job/75242491
75217932,Senior Data Analyst - Marketplace Product,--,SHOPEE SINGAPORE PRIVATE LIMITED,Central Region,Science & Technology,"Mathematics, Statistics & Information Sciences",Full time,,2024-04-18 02:23:51,6d ago,https://www.jobstreet.com.sg/job/75217932
75137646,"Manager, SIT Teaching and Learning Academy (Data Analytics)",We are looking for an educational data analyst to join our team (SIT Teaching & Learning Academy) and help us leverage data to enhance teaching and...,Singapore Institute of Technology,Central Region,Science & Technology,"Mathematics, Statistics & Information Sciences",Contract/Temp,,2024-04-15 05:37:00,9d ago,https://www.jobstreet.com.sg/job/75137646
75318588,Business Development (Data Analyst) Intern - Revenue Marketing Solutions,-,SHOPEE SINGAPORE PRIVATE LIMITED,Central Region,Sales,New Business Development,Full time,,2024-04-22 06:34:24,2d ago,https://www.jobstreet.com.sg/job/75318588
75367686,"Executive, Data & Products","You will be part of a dynamic team to drive growth in designing, managing and developing a Regional Data Warehouse Platform with various local and ...",beIN Sports Asia Pte Limited,Central Region,Science & Technology,"Mathematics, Statistics & Information Sciences",Full time,,2024-04-23 13:46:00,23h ago,https://www.jobstreet.com.sg/job/75367686
75287673,Data analyst application,Our client is the leading American laboratory instrument in Manufacturing Industry. They are actively looking to hire a FPNA Data Analyst & Applica...,RGF,Central Region,Accounting,Cost Accounting,Full time,,2024-04-19 16:53:00,4d ago,https://www.jobstreet.com.sg/job/75287673
75321849,Business Development (Data Analyst) Intern - Seller Revenue Marketing Solution,-,SHOPEE SINGAPORE PRIVATE LIMITED,Central Region,Sales,New Business Development,Full time,,2024-04-22 08:20:42,2d ago,https://www.jobstreet.com.sg/job/75321849
75368257,Data Analyst Intern,"If you love working with technology to create solutions and are not afraid to roll up your sleeves to get things done, you will find your tribe her...",FOODPANDA SINGAPORE PTE. LTD.,Central Region,Accounting,Analysis & Reporting,Full time,,2024-04-23 12:16:00,1d ago,https://www.jobstreet.com.sg/job/75368257
75139657,Digital Solution Sales Representative (Data Analytics),The overarching responsibility for the Solution Representative is to deliver project excellence end to end for the account and grow revenue and inc...,IBM SERVICES TALENT DELIVERY PTE. LTD.,Central Region,Sales,Account & Relationship Management,Full time,,2024-04-15 08:26:00,9d ago,https://www.jobstreet.com.sg/job/75139657
75250769,Regional Data Analyst - APAC,12 Months Contract with MNC Tech Company,Peoplebank Singapore Pte Ltd,Central Region,Information & Communication Technology,Other,Contract/Temp,$9k - $10k per month,2024-04-19 02:20:23,5d ago,https://www.jobstreet.com.sg/job/75250769
75111245,"Executive, Procurement (Data Analytics)","We Know What It Takes, Join Us !",ST Engineering Ltd,North-East Region,"Manufacturing, Transport & Logistics","Purchasing, Procurement & Inventory",Full time,,2024-04-14 07:15:59,10d ago,https://www.jobstreet.com.sg/job/75111245
75321083,"Junior Data Analyst - Business Intelligence, Regional Operations",-,SHOPEE SINGAPORE PRIVATE LIMITED,Central Region,Information & Communication Technology,Business/Systems Analysts,Full time,,2024-04-22 07:48:24,2d ago,https://www.jobstreet.com.sg/job/75321083
75317664,Business Development (Data Analyst) Intern - Revenue Marketing Solutions,-,SHOPEE SINGAPORE PRIVATE LIMITED,Central Region,Sales,New Business Development,Full time,,2024-04-22 06:26:45,2d ago,https://www.jobstreet.com.sg/job/75317664
75354771,BI Analyst,Genie Financial Services on a lookout for BI Analyst,Genie Financial Services,Central Region,Information & Communication Technology,Business/Systems Analysts,Full time,,2024-04-23 10:05:11,1d ago,https://www.jobstreet.com.sg/job/75354771
75253897,"Data Analyst Intern - Seller Operations, Regional Operations (Summer 2024)",--,SHOPEE SINGAPORE PRIVATE LIMITED,Central Region,Science & Technology,"Mathematics, Statistics & Information Sciences",Casual/Vacation,,2024-04-19 03:11:15,5d ago,https://www.jobstreet.com.sg/job/75253897
75368980,Temporary Data Scientist (IORA),"Date: 23 Apr 2024
Location:
SPECIALTY RESEARCH INST/CTRS, Kent Ridge Campus, SG
Company:
National University of Singapore
Job Description
Work hand...",Yale-NUS College,Central Region,Science & Technology,"Mathematics, Statistics & Information Sciences",Casual/Vacation,,2024-04-23 07:10:00,1d ago,https://www.jobstreet.com.sg/job/75368980
75238805,Senior Data Scientist,"As Senior Data Scientist, you will be required to lead the development of distinctive analytical and risk insights that deliver improvements in bus...",Zurich Services (Hong Kong) Limited,Central Region,Science & Technology,"Mathematics, Statistics & Information Sciences",Full time,,2024-04-18 14:51:00,5d ago,https://www.jobstreet.com.sg/job/75238805
75302637,Information Technology - Data Scientist (Data Science Track),"SIA has multiple positions for junior and senior data scientists to drive our AI, data science and business analytics initiatives.
Key Responsibili...",Singapore Airlines,East Region,Science & Technology,"Mathematics, Statistics & Information Sciences",Full time,,2024-04-21 14:39:00,2d ago,https://www.jobstreet.com.sg/job/75302637
75101363,Data Analytics - Senior Associate/AVP,  Master or equivalent in Data Science / Computing. Candidates with equivalent academic qualifications in other disciplines but able to showcase ke...,ORIENT FUTURES INTERNATIONAL (SINGAPORE) PTE. LTD.,West Region,Banking & Financial Services,Corporate Finance & Investment Banking,Full time,,2024-04-12 15:42:00,11d ago,https://www.jobstreet.com.sg/job/75101363
75288007,Data scientist,"Whizmeal is seeking a talented freelance Data Scientist to join our team and support our efforts in analyzing data for clients within the F&B, hosp...",WHIZMEAL PTE. LTD.,Central Region,Accounting,Bookkeeping & Small Practice Accounting,Full time,,2024-04-19 16:53:00,4d ago,https://www.jobstreet.com.sg/job/75288007
75390837,"Analytics, Insights & Reporting - Specialist","And to get there, we need ambitious people who believe in playing an important part in shaping that future. People seeking unmatched career and per...",AIA SINGAPORE PRIVATE LIMITED - GOH HOCK CHYE SAMUEL,Central Region,Science & Technology,"Mathematics, Statistics & Information Sciences",Full time,,2024-04-24 08:18:00,4h ago,https://www.jobstreet.com.sg/job/75390837
75256126,Data Analyst - Search & Recommendation,-,SHOPEE SINGAPORE PRIVATE LIMITED,Central Region,Science & Technology,"Mathematics, Statistics & Information Sciences",Full time,,2024-04-19 03:36:44,5d ago,https://www.jobstreet.com.sg/job/75256126
75299586,Sr Data Analyst (3PL / MNC),An exciting career opportunity for an MNC client in the Logistics & Supply Chain industry.,People Profilers Pte Ltd,East Region,Information & Communication Technology,Business/Systems Analysts,Full time,,2024-04-21 08:15:24,3d ago,https://www.jobstreet.com.sg/job/75299586
75338628,Temporary Data Scientist (IORA),Temporary Data Scientist (IORA),National University of Singapore,Central Region,Education & Training,Other,Contract/Temp,,2024-04-23 01:45:46,1d ago,https://www.jobstreet.com.sg/job/75338628
75367797,System Analyst (Data),"At least 5 years of experience in Data Analytics / BI reporting.Preferably, the incumbent should possess a Diploma / Degree in Computer...",Raffles Medical Group Ltd,Central Region,Information & Communication Technology,Business/Systems Analysts,Full time,,2024-04-24 02:27:39,10h ago,https://www.jobstreet.com.sg/job/75367797
75190963,Data Scientist,"* Major Foreign-Based Manufacturing Organisation in Singapore
* Key Data Role in Singapore
* Employee-Centric Environment",Hudson Global Resources ( HQ ),Central Region,Information & Communication Technology,Engineering - Software,Full time,to be advised,2024-04-17 05:35:19,7d ago,https://www.jobstreet.com.sg/job/75190963
75187339,Internship - Data Scientist,"Does this sound like just the right challenge for you? If so, we look forward to getting to know you!",Infineon Technologies,Central Region,Information & Communication Technology,Business/Systems Analysts,Contract/Temp,,2024-04-17 03:35:18,7d ago,https://www.jobstreet.com.sg/job/75187339
75167648,Data Analyst,"InfoCepts is a global leader of end-to-end data & analytics solutions with nearly 20 years of experience, also named as Gartner s 2020, 2021 and 20...",InfoCepts Pte. Ltd.,East Region,Science & Technology,"Mathematics, Statistics & Information Sciences",Full time,,2024-04-16 07:43:00,8d ago,https://www.jobstreet.com.sg/job/75167648
75179423,Data Analyst (Entry level),"Be able to spot patterns and trends in our data, generate insights and hypotheses, and propose solutions to address business or product problems.
B...",Carousell Pte Ltd,Central Region,Information & Communication Technology,Business/Systems Analysts,Full time,,2024-04-16 22:39:00,7d ago,https://www.jobstreet.com.sg/job/75179423
75322297,Risk Data Analyst - SeaMoney Credit,-,SHOPEE SINGAPORE PRIVATE LIMITED,Central Region,Information & Communication Technology,Business/Systems Analysts,Full time,,2024-04-22 08:38:35,2d ago,https://www.jobstreet.com.sg/job/75322297
75217535,Data Manager,Our client seeks a visionary Data Manager to lead the charge in their digital transformation.,Robert Half International Pte Ltd,Central Region,Information & Communication Technology,Business/Systems Analysts,Full time,Competitive,2024-04-18 02:11:59,6d ago,https://www.jobstreet.com.sg/job/75217535
