job_id,titles,teasers,companies,locations,categorys,subCategories,job_types,salaries,dateposted,datedisplay,url
75276823,Product Operation Manager - AI/LLM Operation,"TikTok will be prioritizing applicants who have a current right to work in Singapore, and do not require TikTok sponsorship of a visa. TikTok is th...",TIKTOK PTE. LTD.,Central Region,Information & Communication Technology,Programme & Project Management,Full time,,2024-04-18 22:04:00,5d ago,https://www.jobstreet.com.sg/job/75276823
75287745,Senior Executive / Assistant Programme Manager for AI Singapore (Innovation),AI Singapore is sourcing for an individual to join the AI Innovation team as an Assistant Programme Manager / Senior Executive. The Assistant Progr...,Yale-NUS College,Central Region,Education & Training,Workplace Training & Assessment,Full time,,2024-04-19 16:15:00,4d ago,https://www.jobstreet.com.sg/job/75287745
75206960,Systems Engineer | AI-HPC,"- Be involved in complex architectural design and development of AI-HPC infrastructure.
- Ensures completeness and compatibility of the technical i...",NovaGlobal Pte Ltd,West Region,Information & Communication Technology,Architects,Full time,,2024-04-17 13:43:00,6d ago,https://www.jobstreet.com.sg/job/75206960
75198844,Gen AI Developer,Hiring Gen-AI Developer,Aquis Search Pte Ltd,Central Region,Information & Communication Technology,Engineering - Software,Contract/Temp,,2024-04-17 08:00:10,7d ago,https://www.jobstreet.com.sg/job/75198844
75239279,Product Manager (Content Safety) - AI Innovation Business,We are seeking a senior product manager with a focus on community safety. This role requires a deep understanding of industry and user needs to ens...,BYTEDANCE PTE. LTD.,Central Region,Marketing & Communications,Product Management & Development,Full time,,2024-04-18 14:53:00,5d ago,https://www.jobstreet.com.sg/job/75239279
75369823,Research Fellow (AI Finance),"- Experience of conducting interdisciplinary research. Relevant experience in international finance, public finance, and econometrics would be a pl...",Yale-NUS College,Central Region,Administration & Office Support,Administrative Assistants,Full time,,2024-04-18 12:00:00,6d ago,https://www.jobstreet.com.sg/job/75369823
75191081,Internship - Enhance Reports & Process via Automation AI,"Does this sound like just the right challenge for you? If so, we look forward to getting to know you!",Infineon Technologies,Central Region,Information & Communication Technology,Database Development & Administration,Contract/Temp,,2024-04-17 05:40:02,7d ago,https://www.jobstreet.com.sg/job/75191081
75196183,AI Engineer - Marketplace Intelligence and Data,-,SHOPEE SINGAPORE PRIVATE LIMITED,Central Region,Science & Technology,"Mathematics, Statistics & Information Sciences",Full time,,2024-04-17 06:48:24,7d ago,https://www.jobstreet.com.sg/job/75196183
75185505,Principle Anti-Fraud AI Engineer - Search & Recommendation,-,SHOPEE SINGAPORE PRIVATE LIMITED,Central Region,Information & Communication Technology,Engineering - Software,Full time,,2024-04-17 02:56:28,7d ago,https://www.jobstreet.com.sg/job/75185505
75144816,Software Engineer (AI Sub-system),We are seeking a talented and motivated Software Engineer (AI Sub-system) to join our R&D team to support the exploration and design of our next ge...,Renesas Electronics Singapore Pte. Ltd.,Central Region,Engineering,Electrical/Electronic Engineering,Full time,,2024-04-15 19:21:00,8d ago,https://www.jobstreet.com.sg/job/75144816
75184763,Senior Executive / Assistant Programme Manager for AI Singapore (Innovation),Senior Executive / Assistant Programme Manager for AI Singapore (Innovation),National University of Singapore,Central Region,Education & Training,Other,Full time,,2024-04-17 02:35:40,7d ago,https://www.jobstreet.com.sg/job/75184763
75367439,Senior Executive / Assistant Programme Manager for AI Singapore (Innovation),AI Singapore is sourcing for an individual to join the AI Innovation team as an Assistant Programme Manager / Senior Executive. The Assistant Progr...,Yale-NUS College,Central Region,Education & Training,Workplace Training & Assessment,Full time,,2024-04-17 12:00:00,7d ago,https://www.jobstreet.com.sg/job/75367439
75176050,Technology Sales Specialist - Data & AI,"A Technology Sales Specialist role (what we internally call a,  Brand Sales Specialist ) in IBM s Data & AI brand means accelerating enterprises  s...",IBM SERVICES TALENT DELIVERY PTE. LTD.,Central Region,Sales,Sales Representatives/Consultants,Full time,,2024-04-16 14:13:00,7d ago,https://www.jobstreet.com.sg/job/75176050
75202758,"Technology Sales - Brand Partner Specialist, Data & AI","Engaging directly with partners and their clients in support of high value engagements and opportunities, you will augment partner and client engag...",IBM SERVICES TALENT DELIVERY PTE. LTD.,Central Region,Sales,Account & Relationship Management,Full time,,2024-04-17 05:53:00,7d ago,https://www.jobstreet.com.sg/job/75202758
75167082,HR Officer – AI and Robotics Company,"About Us: We are a leading AI and robotics company at the forefront of technological innovation, dedicated to creating cutting-edge solutions that ...",DCONSTRUCT ROBOTICS PTE. LTD.,Central Region,Human Resources & Recruitment,Consulting & Generalist HR,Full time,,2024-04-16 07:45:00,8d ago,https://www.jobstreet.com.sg/job/75167082
75144875,AI compiler Engineer (AI Sub-system),"We are seeking a talented and motivated AI compiler Engineer (AI Sub-system) to join our R&D team to own, define, and drive exploration and design ...",Renesas Electronics Singapore Pte. Ltd.,Central Region,Engineering,Electrical/Electronic Engineering,Full time,,2024-04-15 19:21:00,8d ago,https://www.jobstreet.com.sg/job/75144875
75133185,Senior AI Engineer (Technical Documentation and Community Engagement) (Products),Senior AI Engineer (Technical Documentation and Community Engagement) for AI Singapore (Products),National University of Singapore,Central Region,Education & Training,Other,Full time,,2024-04-15 07:55:20,9d ago,https://www.jobstreet.com.sg/job/75133185
75367969,Research Fellow for AI Singapore (Research),The programme office is hosted by the National University of Singapore (NUS) and brings together all Singapore-based research institutions and the ...,Yale-NUS College,Central Region,Education & Training,Research & Fellowships,Full time,,2024-04-15 12:00:00,9d ago,https://www.jobstreet.com.sg/job/75367969
75109324,"Field Engineering, Generative AI Product Specialist","You have expertise in Data Science, Machine Learning, Generative AI, NLP and Computer Vision and expertise in using PySpark and SQL. You will excel...",Databricks,Central Region,Information & Communication Technology,Product Management & Development,Full time,,2024-04-13 18:59:00,10d ago,https://www.jobstreet.com.sg/job/75109324
75328315,Software Engineer / Automated Vision Equipment / Kallang,Carry out Research & Development in Image Processing / Computer Vision Algorithm for automated optical inspection systems,WORKSTONE PTE. LTD.,East Region,Information & Communication Technology,Engineering - Software,Full time,"$4,500 – $6,000 per month",2024-04-22 13:40:39,1d ago,https://www.jobstreet.com.sg/job/75328315
75105797,Full-stack Software Developer for AI Chatbot Startup,We're looking for talented and motivated junior to mid-level software engineers who are looking to challenge and improve themselves while building ...,BotDistrikt,Central Region,Information & Communication Technology,Developers/Programmers,Full time,,2024-04-13 01:14:00,11d ago,https://www.jobstreet.com.sg/job/75105797
75090003,"OpenShift Sales Specialist (AI), APAC",The OpenShift Sales Specialist for AI assumes a pivotal role in providing expert sales support for the seamless execution of Go-To-Market (GTM) str...,Red Hat Asia Pacific Pte Ltd,Central Region,Information & Communication Technology,Management,Full time,,2024-04-12 04:22:00,12d ago,https://www.jobstreet.com.sg/job/75090003
75050050,AI Software Engineer,Pensees R&D team is searching for an outstanding software engineer to build the AIGC framework of the future. Join us in developing the AIGC platfo...,Pensees Pte Ltd,Central Region,Information & Communication Technology,Developers/Programmers,Full time,,2024-04-10 16:40:00,13d ago,https://www.jobstreet.com.sg/job/75050050
75078616,Professional Officer (All Levels) in (Generative AI) (SPICE),-,Singapore Institute of Technology,North-East Region,Information & Communication Technology,Developers/Programmers,Contract/Temp,,2024-04-12 01:12:29,12d ago,https://www.jobstreet.com.sg/job/75078616
75106837,"Director, Smart Manufacturing & AI- Finance & Cost","Work at the intersection of Finance, Manufacturing, Procurement & Supply chain to drive initiatives such as inventory management, improve COGS, etc...",MICRON SEMICONDUCTOR ASIA OPERATIONS PTE LTD,Central Region,Consulting & Strategy,Management & Change Consulting,Full time,,2024-04-13 04:19:00,11d ago,https://www.jobstreet.com.sg/job/75106837
75097792,Solution Architect - Data & AI,We are seeking a highly skilled and experienced Solution Architect   Data Analytics for AWS to join our team and play a crucial role in designing a...,SoftwareONE Pte Ltd,Central Region,Science & Technology,"Mathematics, Statistics & Information Sciences",Full time,,2024-04-12 10:34:00,12d ago,https://www.jobstreet.com.sg/job/75097792
75063869,Postdoctoral Associate / Research Scientist (Designing human-AI teams) (CS),The M3S programme aims to promote the use of AI and machines for practical applications through an intersectional approach.,Singapore-MIT Alliance for Research and Technology Centre,Central Region,Science & Technology,Biotechnology & Genetics,Full time,,2024-04-11 06:28:27,13d ago,https://www.jobstreet.com.sg/job/75063869
75318214,"Computer Vision Research Scientist, Intelligent Creation",About Tiktok TikTok is the leading destination for short-form mobile video. Our mission is to inspire creativity and bring joy. TikTok has global o...,TIKTOK PTE. LTD.,Central Region,Education & Training,Research & Fellowships,Full time,,2024-04-22 03:04:00,2d ago,https://www.jobstreet.com.sg/job/75318214
75048739,Data Engineer - Applied AI,"TikTok is the leading destination for short-form mobile video. At TikTok, our mission is to inspire creativity and bring joy. TikTok's global headq...",TIKTOK PTE. LTD.,Central Region,Science & Technology,"Mathematics, Statistics & Information Sciences",Full time,,2024-04-10 06:53:00,14d ago,https://www.jobstreet.com.sg/job/75048739
75064370,Research Engineer (Designing human-AI teams) (CS),The M3S programme aims to promote the use of AI and machines for practical applications through an intersectional approach.,Singapore-MIT Alliance for Research and Technology Centre,Central Region,Engineering,Other,Full time,,2024-04-11 06:32:38,13d ago,https://www.jobstreet.com.sg/job/75064370
75064209,Postdoctoral Associate / Research Scientist (Designing human-AI teams) (SS),The M3S programme aims to promote the use of AI and machines for practical applications through an intersectional approach.,Singapore-MIT Alliance for Research and Technology Centre,Central Region,Science & Technology,Biotechnology & Genetics,Full time,,2024-04-11 06:31:12,13d ago,https://www.jobstreet.com.sg/job/75064209
75064510,Research Engineer (Designing human-AI teams) (SS),The M3S programme aims to promote the use of AI and machines for practical applications through an intersectional approach.,Singapore-MIT Alliance for Research and Technology Centre,Central Region,Science & Technology,Other,Full time,,2024-04-11 06:34:00,13d ago,https://www.jobstreet.com.sg/job/75064510
75370048,Senior Engineer/Tech Lead for AI Singapore (AI Products),"The Senior Engineer/Tech Lead will be expected to provide technical leadership, drive collaboration with cross-functional teams within AI Products ...",Yale-NUS College,Central Region,Information & Communication Technology,Programme & Project Management,Full time,,2024-04-11 12:00:00,13d ago,https://www.jobstreet.com.sg/job/75370048
75068284,"Health Solution Partner, AI","Responsible for onboarding customers to new operating model platforms
(e.g., Digital Engagement Portal)
Knowledgeable of customer preferences for c...",Pfizer Pte Ltd,Central Region,Call Centre & Customer Service,Management & Support,Full time,,2024-04-11 06:00:00,13d ago,https://www.jobstreet.com.sg/job/75068284
75369123,Natural Language Processing Engineer for AI Singapore (Products),"We are looking for an AI Engineer to perform development and engineering work for NLP products under AI Singapore.
Duties & Responsibilities
  Deve...",Yale-NUS College,Central Region,Education & Training,Research & Fellowships,Full time,,2024-04-10 12:00:00,14d ago,https://www.jobstreet.com.sg/job/75369123
75367775,Associate Professor (Engineering Systems and Design Pillar),"The Singapore University of Technology and Design (SUTD) has topped the list of emerging engineering schools (MIT report, 2018) and possesses a uni...",SUTD (Singapore University of Technology & Design),Central Region,Engineering,Management,Contract/Temp,,2024-04-23 13:48:00,23h ago,https://www.jobstreet.com.sg/job/75367775
75368553,Senior Research Fellow (AI & Tech),"Applications are invited for a Senior Research Fellow position in the Centre for International Law (CIL), National University of Singapore. This is...",Yale-NUS College,Central Region,Education & Training,Teaching - Tertiary,Full time,,2024-04-10 12:00:00,14d ago,https://www.jobstreet.com.sg/job/75368553
75375244,"Senior Software Engineer, Data Quality Engineering, Google Geo","Google's software engineers develop the next-generation technologies that change how billions of users connect, explore, and interact with informat...",Google Inc.,Central Region,Science & Technology,"Mathematics, Statistics & Information Sciences",Full time,,2024-04-23 01:45:00,1d ago,https://www.jobstreet.com.sg/job/75375244
75023897,"Director, Product Management (AI)","Develop and drive the product vision, strategy, and roadmap for AI-driven products in the cryptocurrency and blockchain industry.
Conduct in-depth ...",Crypto,Central Region,Marketing & Communications,Product Management & Development,Full time,,2024-04-09 06:20:00,15d ago,https://www.jobstreet.com.sg/job/75023897
75381104,"Research Engineer (1-year contract), SCIS","Minimum one year of relevant research experience in deep learning or operations research
Proficiency in programming languages such as Python is req...",Singapore Management University,Central Region,Education & Training,Research & Fellowships,Contract/Temp,,2024-04-24 04:38:00,8h ago,https://www.jobstreet.com.sg/job/75381104
75368124,Programme Manager for AI Singapore,AI Singapore is sourcing for an individual to join the Core team as a Programme Manager. The Programme Manager will assist the Director of Planning...,Yale-NUS College,Central Region,Administration & Office Support,Office Management,Full time,,2024-04-09 12:00:00,15d ago,https://www.jobstreet.com.sg/job/75368124
75017244,Platforms Engineer (MLOps) for AI Singapore,Platforms Engineer (MLOps) for AI Singapore,National University of Singapore,Central Region,Education & Training,Other,Full time,,2024-04-09 05:15:58,15d ago,https://www.jobstreet.com.sg/job/75017244
75002826,AI Software Engineer,"At least 2 years of Experience in developing Vision AI applications, i.e. object detection & classification, object segmentation, computer vision a...",CYNAPSE PTE. LTD.,Central Region,Information & Communication Technology,Architects,Full time,,2024-04-08 12:37:00,16d ago,https://www.jobstreet.com.sg/job/75002826
75381200,"Manager/Assistant Director (RPA specialist), Data Governance & Transformation","The candidate will work in the Data Governance and Transformation Department under DGO. They will design, develop, and implement automation solutio...",Public Service Division,Central Region,Information & Communication Technology,Management,Full time,,2024-04-24 02:31:00,10h ago,https://www.jobstreet.com.sg/job/75381200
74992913,Solution Architect - Data & AI - Industry Solutions,"The D&AI Solution Architect works with customer to deliver high ROI solutions with a focus on modern data platforms, analytics, machine learning & ...",Microsoft,Central Region,Information & Communication Technology,Architects,Full time,,2024-04-07 03:36:00,17d ago,https://www.jobstreet.com.sg/job/74992913
75375587,Professional Officer (All Levels) in Diagnostic Radiography,-,Singapore Institute of Technology,Central Region,Healthcare & Medical,Medical Imaging,Contract/Temp,,2024-04-24 03:57:48,8h ago,https://www.jobstreet.com.sg/job/75375587
74969866,Robotics Researcher - AI and Robotics Company,"About Us: We are a leading AI and robotics company at the forefront of technological innovation, dedicated to creating cutting-edge solutions that ...",DCONSTRUCT ROBOTICS PTE. LTD.,Central Region,Education & Training,Research & Fellowships,Full time,,2024-04-05 23:31:00,18d ago,https://www.jobstreet.com.sg/job/74969866
75331528,Video Analytics System Support,"6. The System Support shall have experience in VA or similar project management.
7. Experience in VA system management or equivalent role.
8. Exper...",MTS SYSTEMS ENGINEERING PTE. LTD.,Central Region,Engineering,Electrical/Electronic Engineering,Full time,,2024-04-22 14:13:00,1d ago,https://www.jobstreet.com.sg/job/75331528
75270563,Identity Verification (KYC) Algorithm Engineer - Marketplace Intelligence & Data,-,SHOPEE SINGAPORE PRIVATE LIMITED,Singapore,Information & Communication Technology,Engineering - Software,Full time,,2024-04-19 07:00:22,5d ago,https://www.jobstreet.com.sg/job/75270563
74969889,Hardware Engineer - AI and Robotics Company,"About Us: We are a leading AI and robotics company at the forefront of technological innovation, dedicated to creating cutting-edge solutions that ...",DCONSTRUCT ROBOTICS PTE. LTD.,Central Region,Engineering,Electrical/Electronic Engineering,Full time,,2024-04-05 23:32:00,18d ago,https://www.jobstreet.com.sg/job/74969889
74942894,Generative AI Engineer - J44192,Generative AI Engineer with keen interest in nation-wide initiatives.,ScienTec Consulting Pte Ltd,Central Region,Information & Communication Technology,Developers/Programmers,Full time,,2024-04-05 03:04:03,19d ago,https://www.jobstreet.com.sg/job/74942894
75369424,Research Fellow (AI Ethics in Healthcare),The Centre for Biomedical Ethics (CBmE) was established in September 2006 in the Yong Loo Lin School of Medicine through a generous gift by the Che...,Yale-NUS College,Central Region,Education & Training,Research & Fellowships,Full time,,2024-04-07 12:00:00,17d ago,https://www.jobstreet.com.sg/job/75369424
75368320,Research Assistant / Research Associate in AI and Machine Learning,We are seeking a Research Assistant / Research Associate with a strong background in AI and machine learning to join our dynamic team. Successful c...,Yale-NUS College,Central Region,Science & Technology,"Mathematics, Statistics & Information Sciences",Full time,,2024-04-06 12:00:00,18d ago,https://www.jobstreet.com.sg/job/75368320
75238013,Algorithm engineer ecommerce knowledge,"TikTok will be prioritizing applicants who have a current right to work in Singapore, and do not require TikTok's sponsorship of a visa. TikTok is ...",TIKTOK PTE. LTD.,Central Region,Science & Technology,"Mathematics, Statistics & Information Sciences",Full time,,2024-04-18 12:46:00,6d ago,https://www.jobstreet.com.sg/job/75238013
74970088,Tech Trainer - AI and Robotics Company,Job Description: We are looking for an enthusiastic Technical Trainer to educate people in the technological field of AI and Robotics. You will dev...,DCONSTRUCT ROBOTICS PTE. LTD.,Central Region,Education & Training,Workplace Training & Assessment,Full time,,2024-04-05 23:33:00,18d ago,https://www.jobstreet.com.sg/job/74970088
75270135,Algorithm Engineer - Search & Recommendation (Campus Recruitment 2024),-,SHOPEE SINGAPORE PRIVATE LIMITED,Central Region,Information & Communication Technology,Engineering - Software,Full time,,2024-04-19 06:51:45,5d ago,https://www.jobstreet.com.sg/job/75270135
74931682,AI Researcher,"Identify and develop core data and AI science components for the delivery of projects, architect specialised database and computing environments, e...",ANTCHAIN TECHNOLOGY PTE. LTD.,West Region,Science & Technology,"Mathematics, Statistics & Information Sciences",Full time,,2024-04-04 12:08:00,20d ago,https://www.jobstreet.com.sg/job/74931682
74970386,Finance Manager - AI and Robotics Company,"About Us: We are a leading AI and robotics company at the forefront of technological innovation, dedicated to creating cutting-edge solutions that ...",DCONSTRUCT ROBOTICS PTE. LTD.,Central Region,Accounting,Financial Accounting & Reporting,Full time,,2024-04-05 23:31:00,18d ago,https://www.jobstreet.com.sg/job/74970386
74961510,Senior AI Engineer/Scientist,We are looking for candidates to fulfil a role in AI Team as Engineer/ Senior Engineer. He/ She will be part of a dynamic team involved in deployin...,Hendricks Corp,North-East Region,Information & Communication Technology,Engineering - Software,Full time,,2024-04-05 08:44:00,19d ago,https://www.jobstreet.com.sg/job/74961510
75197939,Senior Machine learning Platform Engineer - Paid Ads,-,SHOPEE SINGAPORE PRIVATE LIMITED,Central Region,Information & Communication Technology,Developers/Programmers,Full time,,2024-04-17 07:24:57,7d ago,https://www.jobstreet.com.sg/job/75197939
74938422,Senior AI or AI Software Engineer,Pensees R&D team is searching for an outstanding software engineer to build the AIGC framework of the future. Join us in developing the AIGC platfo...,Pensees Pte Ltd,Central Region,Information & Communication Technology,Developers/Programmers,Full time,,2024-04-04 21:00:00,19d ago,https://www.jobstreet.com.sg/job/74938422
75159616,Software Engineer (Vision),"- Major Manufacturing MNC in Singapore
- Newly Created role
- Key Innovation Role",Hudson Global Resources ( HQ ),Central Region,Information & Communication Technology,Engineering - Software,Full time,to be advised,2024-04-16 06:00:57,8d ago,https://www.jobstreet.com.sg/job/75159616
74906646,Data Scientist - Applied AI (DCC),"TikTok is the leading destination for short-form mobile video. At TikTok, our mission is to inspire creativity and bring joy. TikTok's global headq...",TIKTOK PTE. LTD.,Central Region,Science & Technology,"Mathematics, Statistics & Information Sciences",Full time,,2024-04-03 18:51:00,20d ago,https://www.jobstreet.com.sg/job/74906646
74897670,AI Engineer,"As an AI/ML Engineer at LTS, you will play a crucial role in developing and enhancing our AI-driven products and services. We're seeking a talented...",LAWNET TECHNOLOGY SERVICES PTE. LTD.,West Region,Information & Communication Technology,Team Leaders,Full time,,2024-04-03 06:00:00,21d ago,https://www.jobstreet.com.sg/job/74897670
74938354,"Head of Global AI Data Service and Operations, Partnership Management","About TikTok TikTok is the leading destination for short-form mobile video. At TikTok, our mission is to inspire creativity and bring joy. TikTok's...",TIKTOK PTE. LTD.,Central Region,Information & Communication Technology,Management,Full time,,2024-04-04 21:39:00,19d ago,https://www.jobstreet.com.sg/job/74938354
74904435,Presales Solution Architect (Data & AI),"At least 5 years of experience in a solution architect role, focusing on data technologies, with some exposure to AI or a strong interest in develo...",T-Systems Singapore Pte Ltd,East Region,Information & Communication Technology,Architects,Full time,,2024-04-03 16:38:00,20d ago,https://www.jobstreet.com.sg/job/74904435
74900766,AI Project Manager,"2. At least 5 years of work experience in AI project management
3. Hold PMP certificate, Scrum master certificate are pefered
4. Excellent facilita...",AIGEL TECHNOLOGIES PTE. LTD.,West Region,Information & Communication Technology,Programme & Project Management,Full time,,2024-04-03 08:49:00,21d ago,https://www.jobstreet.com.sg/job/74900766
75112952,MLOps Engineer,"In this role, you will be part of the AI & Cloud Engineering (ACE) Division and MLOps team. We are developing a comprehensive AI strategy that deli...",Renesas Electronics Singapore Pte. Ltd.,Central Region,Engineering,Electrical/Electronic Engineering,Full time,,2024-04-14 13:02:00,9d ago,https://www.jobstreet.com.sg/job/75112952
75190371,Algorithm Engineer Intern - Search & Recommendation (Summer 2024),-,SHOPEE SINGAPORE PRIVATE LIMITED,Central Region,Information & Communication Technology,Engineering - Software,Full time,,2024-04-17 05:10:32,7d ago,https://www.jobstreet.com.sg/job/75190371
74927675,Senior Engineering Manager (AI/ML),"As the Senior Engineering Manager, you'll be at the helm of a team of skilled developers, driving the creation of innovative products that leverage...",Zopim Technologies Pte Ltd,Central Region,Information & Communication Technology,Team Leaders,Full time,,2024-04-04 07:51:00,20d ago,https://www.jobstreet.com.sg/job/74927675
74906660,"Product Operation Manager, AI Ops (Prompt Engineering Specialization)","TikTok will be prioritizing applicants who have a current right to work in Singapore, and do not require TikTok sponsorship of a visa. TikTok is th...",TIKTOK PTE. LTD.,Central Region,Marketing & Communications,Product Management & Development,Full time,,2024-04-03 18:51:00,20d ago,https://www.jobstreet.com.sg/job/74906660
75238073,Research scientist,Skywork AI Singapore welcomes enthusiastic and forward-thinking research scientists to join our dynamic team at the Kunlun-2050 Research Lab Singap...,SKYWORK AI PTE. LTD.,Central Region,Engineering,Electrical/Electronic Engineering,Full time,,2024-04-18 12:46:00,6d ago,https://www.jobstreet.com.sg/job/75238073
