,Job_ID,url,Job_txt,company,job-title,level,location,posted-time-ago,nb_candidats,scraping_date,posted_date
87,3798535463,https://www.linkedin.com/jobs/collections/recommended/?currentJobId=3798535463,"TikTok Shop - E-commerce Data Analyst , Logistics (Singapore) TikTok Singapore 1 month ago Over 200 applicants See who TikTok has hired for this role Apply Join or sign in to find your next job Join to apply for the TikTok Shop - E-commerce Data Analyst , Logistics (Singapore) role at TikTok Not you? Remove photo First name Last name Email Password (6+ characters) ,  ,  .   Already on LinkedIn? . .  Sign in to save TikTok Shop - E-commerce Data Analyst , Logistics (Singapore) at TikTok . Email or phone Password Show Forgot password? Sign in Report this job Responsibilities About us TikTok is the leading destination for short-form mobile video. Our mission is to inspire creativity and bring joy. TikTok has global offices including Los Angeles, New York, London, Paris, Berlin, Dubai, Singapore, Jakarta, Seoul and Tokyo. Why Join Us Creation is the core of TikTok's purpose. Our platform is built to help imaginations thrive. This is doubly true of the teams that make TikTok possible. Together, we inspire creativity and bring joy - a mission we all believe in and aim towards achieving every day. To us, every challenge, no matter how difficult, is an opportunity; to learn, to innovate, and to grow as one team. Status quo? Never. Courage? Always. At TikTok, we create together and grow together. That's how we drive impact - for ourselves, our company, and the communities we serve. Join us. About the Team The data analytics team will be responsible for data analysis of TikTok e-commerce's global logistics operations What You'll Do 1. Responsible for data analysis of TikTok e-commerce's global logistics operations; 2. Maintain & improve operation performance index; assist top management to monitor the weekly and bi-monthly operation performance; analyze results using statistical techniques and provide ongoing reports; 3. Cooperate with logistics team to set strategy, e.g. Leadtime improvement, cost reduction, logistics experience rating, etc; communicate findings to influence others to take actions; 4. Follow-up data analysis of local operation teams in several overseas markets, support operation and provide optimization suggestions; 5. Cooperate with Products and ETL teams to define system requirements, build data products, improve and roll-out product features to support business. Qualifications Minimum Qualifications: 1. Bachelor degree or above with 3 years above working experience in data analysis 2. Proficient in English 3. Proficient in SQL and familiar with Python or R Preferred Qualifications: 1. Degree from Logistics and Supply Chain Management, Operation Research, Mathematics, Statistics, Computer Science is preferred 2. Have working experience in logistics is a preferred 3. High energy, self-motivation and ability to work in a fast-growing environment TikTok is committed to creating an inclusive space where employees are valued for their skills, experiences, and unique perspectives. Our platform connects people from across the globe and so does our workplace. At TikTok, our mission is to inspire creativity and bring joy. To achieve that goal, we are committed to celebrating our diverse voices and to creating an environment that reflects the many communities we reach. We are passionate about this and hope you are too. Show more Show less Seniority level Not Applicable Employment type Full-time Job function Research, Analyst, and Information Technology Industries Entertainment Providers Referrals increase your chances of interviewing at TikTok by 2x See who you know",TikTok,"TikTok Shop - E-commerce Data Analyst , Logistics (Singapore)",Not Applicable,Singapore,1 month ago,,2024-04-26,2024-03-27
88,3792634253,https://www.linkedin.com/jobs/collections/recommended/?currentJobId=3792634253,"Lark Trust & Safety Data Analysis and Operation Intern - 2024 Start Lark Singapore 1 month ago Over 200 applicants See who Lark has hired for this role Apply Join or sign in to find your next job Join to apply for the Lark Trust & Safety Data Analysis and Operation Intern - 2024 Start role at Lark Not you? Remove photo First name Last name Email Password (6+ characters) ,  ,  .   Already on LinkedIn? . .  Sign in to save Lark Trust & Safety Data Analysis and Operation Intern - 2024 Start at Lark . Email or phone Password Show Forgot password? Sign in Report this job Responsibilities About Lark Lark is a next-generation team productivity suite that boosts organizations' efficiency, creativity, and engagement. It seamlessly integrates Messenger, Docs, Calendar, Video calls, Emails, OKR, and more into one easy-to-use app. Why Join Us Creation is the core of ByteDance's purpose. Our products are built to help imaginations thrive. This is doubly true of the teams that make our innovations possible. Together, we inspire creativity and enrich life - a mission we aim towards achieving every day. To us, every challenge, no matter how ambiguous, is an opportunity; to learn, to innovate, and to grow as one team. Status quo? Never. Courage? Always. At ByteDance, we create together and grow together. That's how we drive impact - for ourselves, our company, and the users we serve. Join us. Lark Trust & Safety Team Lark Trust & Safety, responsible for providing global compliance solutions, defining risk events and standardizing control processes; through the establishment of behavior detection and content abstraction tools to refine risk ops mechanisms, and guarantee a secure ecology for Lark monetization. We are looking for talented individuals to join us for an internship in 2024. Internships at ByteDance aim to offer students industry exposure and hands-on experience. Watch your ambitions become reality as your inspiration brings infinite opportunities at ByteDance. Successful candidates must be able to commit to one of the following internship cycles below: Summer Internship - 06 May 2024 to 26 July 2024 (12 weeks) Off cycle / Credit bearing - Starting 08 January 2024 or 12 August 2024 We will prioritize candidates who are able to commit in either internship period. Please state your availability clearly in your resume (Start date, End date). Candidates can apply to a maximum of two positions and will be considered for jobs in the order you apply. The application limit is applicable to ByteDance and its affiliates' jobs globally. Applications will be reviewed on a rolling basis - we encourage you to apply early. Responsibilities: Work closely with Lark global cross-functional teams (Global legal, SaaS, data analytics, product, R&D) to identify, assess and define risk points of Lark business scenarios, design risk control processes, and provide security solutions; Build Lark Trust & Safety KPI system , including but not limited to core indicators such as risk, efficiency, quality and experience, effectively monitor product & business performance with data-driven motivation; Undertake the role of moderation operation & project manager , and ensure the smooth implementation and long-term operation of product functions; through the review and analysis of report & appeal contents from Lark overseas users, precipitate risk control methodology and empower risk product operation. Qualifications Currently pursuing a Bachelor or Master's degree; Relevant product/risk operation/project management experience, overseas Internet project experience is preferred; Excellent communication in both English and Chinese, both written and oral; Good at risk control strategy design and operation, good data analytics ability, visual design ability, problem solving/promotion ability; Ability to undertake projects independently. ByteDance is committed to creating an inclusive space where employees are valued for their skills, experiences, and unique perspectives. Our platform connects people from across the globe and so does our workplace. At ByteDance, our mission is to inspire creativity and enrich life. To achieve that goal, we are committed to celebrating our diverse voices and to creating an environment that reflects the many communities we reach. We are passionate about this and hope you are too. By submitting an application for this role, you accept and agree to our global applicant privacy policy, which may be accessed here: https://jobs.bytedance.com/en/legal/privacy. If you have any questions, please reach out to us at apac-earlycareers@bytedance.com Show more Show less Seniority level Entry level Employment type Internship Job function Information Technology Industries Technology, Information and Internet Referrals increase your chances of interviewing at Lark by 2x See who you know",Lark,Lark Trust & Safety Data Analysis and Operation Intern - 2024 Start,Entry level,Singapore,1 month ago,,2024-04-26,2024-03-27
89,3904470302,https://www.linkedin.com/jobs/collections/recommended/?currentJobId=3904470302,"Data Analyst Neumann Kaffee Gruppe (NKG) Singapore 1 week ago Over 200 applicants See who Neumann Kaffee Gruppe (NKG) has hired for this role Apply Join or sign in to find your next job Join to apply for the Data Analyst role at Neumann Kaffee Gruppe (NKG) Not you? Remove photo First name Last name Email Password (6+ characters) ,  ,  .   Already on LinkedIn? . .  Sign in to save Data Analyst at Neumann Kaffee Gruppe (NKG) . Email or phone Password Show Forgot password? Sign in Report this job We are Neumann Kaffee Gruppe. And we love coffee. For us at Neumann Kaffee Gruppe (NKG), everything revolves around coffee. As a globally active green coffee service group, our more than 3,200 employees in over 26 countries work with dedication for and with green coffee, which is always the focus of our services along the entire coffee supply chain. Our fields of work are just as diverse as our employees and we are proud to live this diversity. Established in 1992, Bero Coffee Singapore represents Neumann Kaffee Gruppe’s operations in Southeast Asia and China. The countries in the region are some of the fastest growing and most dynamic coffee markets in the world. With the interests of roasters, traders and exporters in virtually every coffee producing country, we are able to provide some of the best coffee market information and one of the broadest ranges of coffee products and services available to our partners. Job Description As data analyst for Coffee, you will have close interaction with our teams of agronomists, sustainability experts, and commercial decision makers across our business. This implies working with a multicultural team in several countries in APAC and Europe. Besides a proven expertise and passion for numbers and coffee we are looking for a proactive person willing to take on a big challenge in a dynamic company with plenty of growth opportunities. Key Responsibilities To analyze data related to agricultural practices and sustainability in coffee supply chains. To coordinate with sustainability team on system upgrades or developments of our data collection tools and systems. To assist and guide origins teams on the correct use of data collection tools and systems. To provide guidance to origins for data collection (design surveys, training material, outlier identification, sample methodologies and monitoring) To improve data management systems, focusing on data quality To support data integration between different platforms To provide periodic analysis reports, focusing on data intelligence and data performance (quality) To communicate the value of data through dashboards (for central and origin decision making and reporting, and for external stakeholders) To work on what if scenarios or simulations to forecast outcomes and impacts from sustainability interventions. To assess GHG emission reduction from the implementation of different practices. To highlight insights, trends and other findings that help central decision-making processes. To cover Sustainability Programs data requirements (baselines, impact measurement, using external and internal tools) To continuously update and communicate key metrics. The role has a strong emphasis on sustainability data, but also includes data on prices and supply and demand metrics to support our business on commercial decisions. Job Requirements Bachelor's in engineering, Agroforestry, Business/Economic or similar Excellent written and verbal communication skills. Minimum 2 years' experience in data management and analysis Knowledge of agriculture and/or sustainability (like yield, seasonal effects) Technical Knowledge Statistical and analytical tools Data visualization tools (Power BI) MS Office tools, advanced Excel Knowledge in geographic/satellite data and systems is a plus. Expectations Good at data management Meticulous & thorough in transversal analyzing multiple data points. Proactive and ability to solve problems as they arise. High motivation to work independently in a multicultural environment. Good social and communication skills Travel to coffee operations, if required Please get in touch with your first point of contact: Eva Tiang Show more Show less Seniority level Entry level Employment type Full-time Job function Information Technology Industries International Trade and Development Referrals increase your chances of interviewing at Neumann Kaffee Gruppe (NKG) by 2x See who you know",Neumann Kaffee Gruppe (NKG),Data Analyst,Entry level,Singapore,1 week ago,,2024-04-26,2024-04-19
90,3882802913,https://www.linkedin.com/jobs/collections/recommended/?currentJobId=3882802913,"Data Analyst- Power BI Robert Walters Singapore, Singapore 3 weeks ago Over 200 applicants See who Robert Walters has hired for this role Apply Join or sign in to find your next job Join to apply for the Data Analyst- Power BI role at Robert Walters Not you? Remove photo First name Last name Email Password (6+ characters) ,  ,  .   Already on LinkedIn? . .  Sign in to save Data Analyst- Power BI at Robert Walters . Email or phone Password Show Forgot password? Sign in Report this job Our client is seeking a dedicated and enthusiastic Data Analyst with a strong background in Power BI and ETL tools. This role offers an exciting opportunity to work within a dynamic team, driving data analysis to support decision-making processes. What You'll Do As a Data Analyst with Power BI expertise, you will play a pivotal role in designing, developing, and maintaining data marts according to Business Unit requirements. You will ensure the quality and integrity of data by implementing appropriate governance and management practices. Your collaboration skills will be put to good use as you work alongside IT teams & Data Engineers to optimise the BI infrastructure. Your analytical prowess will shine as you conduct in-depth analyses using advanced statistical techniques to derive actionable insights. You will identify trends, patterns, and correlations in data that can support business decision-making. Design, develop and maintain data marts according to Business Unit requirements Ensure data quality and integrity through the implementation of appropriate data governance and management practices Collaborate with IT teams & Data Engineers to optimise BI infrastructure, ensuring scalability and performance Conduct in-depth data analysis using advanced statistical and analytical techniques to derive actionable insights Identify trends, patterns, and correlations in data to support business decision-making Develop comprehensive reports and dashboards that provide meaningful insights to stakeholders Collaborate with cross-functional teams to understand business requirements and translate them into data analytics solutions Present findings and insights to senior management effectively communicating complex information in a clear manner What You Bring The ideal candidate for the Data Analyst role will bring a strong academic background with a bachelor's degree in a relevant field such as Computer Science, Data Science, Statistics or a related discipline. A master's degree is preferred. You will have at least 1-3 years of relevant work experience and demonstrate expertise in data analytics, business intelligence, and data visualisation tools and technologies. Your strong knowledge of statistical analysis, data modelling, and data mining techniques will be essential to your success in this role. Bachelor's degree in Computer Science, Data Science, Statistics or related discipline; Master's degree preferred Minimum 1-3 years of relevant work experience Expertise in data analytics, business intelligence, and data visualisation tools and technologies Strong knowledge of statistical analysis, data modelling, and data mining techniques Proficiency in SQL and familiarity with programming languages such as Python or R Cloud experience, ideally with GCP Experience creating Dashboards using Tableau & Power BI Excellent analytical, problem-solving, and critical-thinking skills Excellent communication and presentation skills What Sets This Company Apart Our client is a leading player in the FMCG sector. They are renowned for their commitment to innovation and excellence. They offer an inclusive and collaborative work environment where every team member is valued and recognised for their unique contributions. Their focus on professional development ensures that employees are always at the forefront of industry trends and developments. What's Next If you're ready to take your career to the next level with a challenging and rewarding role, we want to hear from you! Apply today by clicking on the link! Do note that we will only be in touch if your application is shortlisted. Robert Walters (Singapore) Pte Ltd ROC No.: 199706961E | EA Licence No.: 03C5451 EA Registration No.: R1439850 Sachet Sethi Show more Show less Seniority level Mid-Senior level Employment type Full-time Job function Information Technology Industries Staffing and Recruiting Referrals increase your chances of interviewing at Robert Walters by 2x See who you know",Robert Walters,Data Analyst- Power BI,Mid-Senior level,"Singapore, Singapore",3 weeks ago,,2024-04-26,2024-04-05
91,3894699048,https://www.linkedin.com/jobs/collections/recommended/?currentJobId=3894699048,,,,,,,,2024-04-26,
92,3843732942,https://www.linkedin.com/jobs/collections/recommended/?currentJobId=3843732942,"Data Science Analyst - Python/R (Data Science & AI) Synapxe Singapore, Singapore 1 month ago Over 200 applicants See who Synapxe has hired for this role Apply Join or sign in to find your next job Join to apply for the Data Science Analyst - Python/R (Data Science & AI) role at Synapxe Not you? Remove photo First name Last name Email Password (6+ characters) ,  ,  .   Already on LinkedIn? . .  Sign in to save Data Science Analyst - Python/R (Data Science & AI) at Synapxe . Email or phone Password Show Forgot password? Sign in Report this job Position Overview Data Science Analyst role supporting Healthcare Analytics workstreams We are expanding our strong data science team and are looking for talented AI practitioner with applied experience in the fields of Machine Learning and Deep learning to join us. This role is best suited for candidate that is interested in developing new AI application that has a direct and immense, real-world healthcare impact. You need to have a deep passion for analyzing and resolving healthcare problems. You display an intellectual curiosity about the business needs as well as the capability to engage with stakeholders to understand business issues. Role & Responsibilities Analyze data, Scope out problem definition and hypothesis for analysis for image/signal data (such as EEG, ECG) related use case Responsible for image analysis, synthesis and other aspects of algorithm development, including visual recognition, object detection, segmentation and signal data pattern recognition etc. Responsible for the exploration of cutting-edge technology in image/signal data related algorithms and ensure the technologies get successfully applied. Design experiments to test data assumptions Evaluate experiment outcomes to draw actionable conclusions Deploy data models across different channels and customer platforms Partner with stakeholders to translate business problems into data science projects Develop strategies to identify, acquire and use appropriate data sets to develop practical solutions and support decision making Maintain an advanced knowledge of trends affecting the industry Synthesize findings into actionable insights Apply data analysis, data mining and data processing to present data clearly Provide rationale, business cases and ROI models to support investment Requirements PhD or Masters in a quantitative field such as Mathematics, Statistics, Information Technology, Physics, Engineering, Finance or equivalent Solid research and engineering background and experience in computer vision, deep learning, and image/signal data processing/analysis algorithms. Good experience with Python or R is prerequisite Good experience with Deep learning framework e.g. Tensorflow, keras, Pytorch is prerequisite Hands on experience in the development of image classification, object detection, segmentation, signal data pattern recognition or related is preferred. Good experience with SQL and/or NoSQL is preferred Preferably, 3 years of relevant working experience. Proven communication skill to explain insights from technical work to non-technical audience through presentation or other means Ability to work independently. Model deployment experience is preferred. Apply Now NOTE: It only takes a few minutes to apply for a meaningful career in HealthTech - GO FOR IT!! Show more Show less Seniority level Entry level Employment type Full-time Job function Information Technology Industries IT Services and IT Consulting Referrals increase your chances of interviewing at Synapxe by 2x See who you know",Synapxe,Data Science Analyst - Python/R (Data Science & AI),Entry level,"Singapore, Singapore",1 month ago,,2024-04-26,2024-03-27
93,3731804094,https://www.linkedin.com/jobs/collections/recommended/?currentJobId=3731804094,,,,,,,,2024-04-26,
