,Job_ID,url,Job_txt,company,job-title,level,location,posted-time-ago,nb_candidats,scraping_date,posted_date
271,3910388345,https://www.linkedin.com/jobs/collections/recommended/?currentJobId=3910388345,"Quant Researcher BALYASNY ASSET MANAGEMENT (SINGAPORE) PTE. LTD. Singapore, Singapore 1 day ago 28 applicants Apply Join or sign in to find your next job Join to apply for the Quant Researcher role at BALYASNY ASSET MANAGEMENT (SINGAPORE) PTE. LTD. Not you? Remove photo First name Last name Email Password (6+ characters) ,  ,  .   Already on LinkedIn? . .  Sign in to save Quant Researcher at BALYASNY ASSET MANAGEMENT (SINGAPORE) PTE. LTD. . Email or phone Password Show Forgot password? Sign in Report this job Balyasny Asset Management (BAM) is a global, multi-strategy investment Firm with over $21 billion in assets under management. We are a diversified business, with global breadth and depth. Our Firm has a clear mission: To consistently deliver uncorrelated returns in all market environments. Today, BAM employs more than 160 portfolio managers and 1,200 investment professionals across 19 offices in the U.S., Europe, the Middle East, and Asia. We are active across six investing strategies: Equities Long/Short, Equities Arbitrage, Macro, Commodities, Systematic, and Growth Equity. We also have a dedicated private investment team, BAM Elevate, and a standalone equities unit, Corbets Capital. Position Summary The Quantitative Research Associate will be focusing on Quantitative research and assisting the portfolio manager with tasks including, but not limited to backtesting, machine-learning, alpha research etc. Role Overview Responsibilities include, but are not limited to: Quantitative Analyst working alongside a Quantitative Portfolio Manager Building libraries, backtesting, machine learning, data cleaning, intraday trading etc. Conducting alpha research independently, and also helping the team with alpha research as required Requirements Bachelor’s degree or the equivalent in Quantitative Finance, Finance, Economics, Mathematics, Engineering or various scientific subjects from a reputable university. 0 -3 years of working experience, and internship experience(s) within the finance sector would be strongly preferred Coding experience in Python. Familiarity with other languages are a plus Ambitious and commercial savvy. Professional demeanour with an eagerness to learn Location preference to be in Singapore Show more Show less Seniority level Mid-Senior level Employment type Full-time Job function Finance and Sales",,Quant Researcher,Mid-Senior level,"Singapore, Singapore",1 day ago,28.0,2024-04-26,2024-04-25
272,3704834265,https://www.linkedin.com/jobs/collections/recommended/?currentJobId=3704834265,,,,,,,,2024-04-26,
273,3864981944,https://www.linkedin.com/jobs/collections/recommended/?currentJobId=3864981944,"AVP, Data/Business Analyst (Qlik Sense), Institutional Banking Group Data Chapter, Group Transformation DBS Bank Singapore, Singapore 1 month ago 75 applicants See who DBS Bank has hired for this role Apply Join or sign in to find your next job Join to apply for the AVP, Data/Business Analyst (Qlik Sense), Institutional Banking Group Data Chapter, Group Transformation role at DBS Bank Not you? Remove photo First name Last name Email Password (6+ characters) ,  ,  .   Already on LinkedIn? . .  Sign in to save AVP, Data/Business Analyst (Qlik Sense), Institutional Banking Group Data Chapter, Group Transformation at DBS Bank . Email or phone Password Show Forgot password? Sign in Report this job Business Function The Institutional Banking Group’s (IBG) Data Centre of Excellence (Data CoE) team is committed to building a data driven organization and maximizing the key data capabilities to transform how IBG does business. Data impacts IBG’s businesses every day, and a culture of relentlessly using data and business intelligence will enable IBG to achieve exponential growth. Responsibilities The Data/Business Analyst works within IBG Data Chapter team to understand IBG’s business priorities Be adept at problem solving, prioritize projects and assignments, serve as the data subject matter expert, manage stakeholders, and be the first point of contact within the squad Build and own data products/solutions for the business, including managing timelines and data product quality Support the business to operate data products/solutions (e.g., models, dashboards) to achieve business outcomes Requirements Degree in Computer Science, Business Analytics, or an equivalent qualification Minimum 8 years of experience working on data/business analytics and partnering with technology teams, data scientists and managing deployment of data analytics projects into production environment Keen understanding of data science and machine learning techniques Strong in building effective dashboards to visualise and present clear, concise, and actionable insights using data visualisation tools (e.g., Qilk Sense, Qlikview) Ability to study and analyse complex systems and large datasets; relate the output of the analysis in a business context. Experience in metadata management and related tools (e.g., Collibra) Competent with using data manipulation tools (e.g., SQL/Python/PySpark) Four to eight years of extensive experience developing dashboards using Qlik Sense Knowledge of transaction banking or corporate banking products will be an advantage Primary Location Singapore-DBS Asia Central Job Analytics Job Posting Apr 23, 2024, 2:40:47 PM Show more Show less Seniority level Not Applicable Employment type Full-time Job function Other Industries Banking, Financial Services, and Investment Banking Referrals increase your chances of interviewing at DBS Bank by 2x See who you know",DBS Bank,"AVP, Data/Business Analyst (Qlik Sense), Institutional Banking Group Data Chapter, Group Transformation",Not Applicable,"Singapore, Singapore",1 month ago,75.0,2024-04-26,2024-03-27
274,3905377168,https://www.linkedin.com/jobs/collections/recommended/?currentJobId=3905377168,"Senior Data Analyst Nanyang Technological University Singapore Singapore, Singapore 1 week ago Be among the first 25 applicants See who Nanyang Technological University Singapore has hired for this role Apply Join or sign in to find your next job Join to apply for the Senior Data Analyst role at Nanyang Technological University Singapore Not you? Remove photo First name Last name Email Password (6+ characters) ,  ,  .   Already on LinkedIn? . .  Sign in to save Senior Data Analyst at Nanyang Technological University Singapore . Email or phone Password Show Forgot password? Sign in Report this job The Senior Data Analyst Role Is Important To Lead and implement Student Data Analytic Projects that aid data-informed decision-making and reporting, as well as to enhance student experience. Manage Student Data Catalogue and metadata in Denodo virtual data warehouse and develop integrated datasets for data analytics and reporting. Fully implement and enforce the Student Data Governance Framework and extensive adoption of the framework by Colleges, Schools, and Departments, that ensures data quality which is most critical for Data Analytics. Train end-users on new reports and dashboards. Responsibilities Leading the implementation of Student Data Governance (SDG) framework across Student Admin Departments, Colleges, and Schools; Secretariat support to the SDG Steering Committee Meetings. Leading and conducting Data Quality (DQ) Assurance programme across different data areas and monitor DQ via developing DQ dashboard. Developing and managing student data catalogue for management reporting and data analytics projects. Driving the adoption of NTU Education Dashboards to support decision-making at different level of the University. Leading, developing, and managing data analytics projects to provide enhanced insights from student data, such as student profiling, data analysis to support policy maker in relevant policies, predictive analysis of students at-risk, degree programme quality assurance analysis, student quantitative or qualitative feedback analysis using Natural Language Processing (NLP). Training staff in data-related framework, concepts, and competency in data analytics. Supporting business data users in student admin process automation. [The role is expected to lead and facilitate, in addition to execution.] Requirements Bachelor's or Master's degree in Data Science, Computer Science, or Mathematics. Over 7 years of professional experience in data analytics and data governance. Demonstrated technical proficiency in data models, database design and development, data mining, and machine learning techniques. Familiarity with Natural Language Processing (NLP) is advantageous. Strong familiarity with data visualization tools such as Qlik Sense, along with programming proficiency in Python/R and SQL. Experience with Robotic Process Automation (RPA) tools like UiPath and Power Automate is a plus. Proven track record in planning and executing data analytics projects to meet business objectives. Excellent communication skills, capable of effectively liaising with business stakeholders to understand data requirements and deliver actionable insights. Hiring Institution: NTU Show more Show less Seniority level Mid-Senior level Employment type Full-time Job function Information Technology Industries Higher Education Referrals increase your chances of interviewing at Nanyang Technological University Singapore by 2x See who you know",Nanyang Technological University Singapore,Senior Data Analyst,Mid-Senior level,"Singapore, Singapore",1 week ago,,2024-04-26,2024-04-19
275,3888290424,https://www.linkedin.com/jobs/collections/recommended/?currentJobId=3888290424,"SAS Data Science AIML Program - Data Analyst Trainee SAS INSTITUTE PTE LTD Singapore, Singapore 2 weeks ago 56 applicants Apply Join or sign in to find your next job Join to apply for the SAS Data Science AIML Program - Data Analyst Trainee role at SAS INSTITUTE PTE LTD Not you? Remove photo First name Last name Email Password (6+ characters) ,  ,  .   Already on LinkedIn? . .  Sign in to save SAS Data Science AIML Program - Data Analyst Trainee at SAS INSTITUTE PTE LTD . Email or phone Password Show Forgot password? Sign in Report this job SAS Insititue Pte. LTD. Data Analyst – SAS Data Science AIML Program Roles & Responsibilities Interested to pursue a career in Analytics? Digital transformation is happening everywhere, impacting our lives daily. With fast-paced development and adoption in artificial intelligence and machine learning, careers for the future demand for talents with analytical minds. Individual are empowered to make tactical decisions and strategies, by building models that provide accurate, reliable and accessible metrics. SAS is committed to nurture qualified, capable individuals, and deepening the skills amongst fresh graduates and young working professionals to be future ready. The SAS Data Science AIML Program is IMDA's Company-Led Training (CLT) initiative to recruit and train fresh professionals in Data Analytics, Artificial Intelligence and Machine Learning. We are currently seeking candidates interested in building a career in Data Analytics. Why SAS? SAS is the leader in analytics. Through innovative analytics, business intelligence and data management software and services, SAS helps customers at more than 80,000 sites make better decisions faster. Since 1976, SAS has been giving customers around the world THE POWER TO KNOW®. This program first started as SAS Business Intelligence and Analytics (BIA) Program in year 2012. It is Singapore’s largest data science and analytics development program supported by IMDA – established over a decade – our curriculum is curated with modules that are constantly updated to meet the latest development and market trends. The program provides in-depth teaching which consists of structured training with assessments, certifications, supervision, and mentorship. It has been rebraned as SAS Data Science Artificial Intelligence Machine Learning (AIML) Program to reflect advancement in our training content as well as a greater focus on AIML. How is the program structured? Your journey begins at SAS with 3-4* months of intensive training and assessments to build your knowledge and skills on SAS Programming, SQL, visual analytics, data preparation, machine learning, forecasting and the list goes on. During the course, you will also attain certifications that are globally accredited, where SAS digital badges posted on your social network profiles can be easily verified by anyone via Credly, our digital credentialing program partner. Finally, upon successful completion of your training, you will join one of our partners for a 6-7*month period, where you can apply what you have learnt and put your skillsets into solving real-world problems (*depending on the curriculum of each respective batch) . Skills You Will Develop Ability to apply and utilize analytical, statistical, and programming skills to collect, analyze, and interpret large data sets Ability to develop and apply custom data models and algorithms to apply to data sets Ability to use supervised and unsupervised machine learning techniques to increase and optimize business outcomes Ability to design, develop and implement fact-based and data-driven solutions to meet business challenges in the era of artificial intelligence Ability to create visualizations and presentations to deliver analytical findings and provide actionable insight What We Are Looking For Graduates who can join us from Jun 2025 OR working professionals who graduated less than 3 years from their degree: B.A. or B.S. degree with a quantitative focus in Computer Science, Information Systems, Math, Statistics, Economics, or equivalent training (we will also consider relevant training attained post-graduation such as Diploma in Data Science) Experience or proficient in querying and manipulating complex raw datasets for analysis using SQL, Python, or R, exposure to ETL Strong analytical, problem-solving, and critical thinking skills. Excellent communication skills Big ambitions to succeed within the IT industry Ability to work autonomously and in a fast-paced environment What We Offer You Full salary with CPF for industry recognized training and qualifications Live interactive classes – Develop innovative problem-solving capabilities in modern techniques of data science using a live online classroom through interactive lectures and labs with advanced course materials provided Access to virtual labs – using SAS high performance software access to develop codes/ models where learning can take place anytime and anywhere Mentorship and access to resources within SAS during the program Guaranteed job posting with our partners for 6 months Receive monthly remuneration throughout the 10-month program Join our network of program Alumni and SAS communities We have multiple start dates all year round, so why not make an application today? Kindly note that only shortlisted candidates will be notified. Please do not email or contact SAS directly. Show more Show less Seniority level Entry level Employment type Full-time Job function Engineering and Information Technology",,SAS Data Science AIML Program - Data Analyst Trainee,Entry level,"Singapore, Singapore",2 weeks ago,56.0,2024-04-26,2024-04-12
276,3907890281,https://www.linkedin.com/jobs/collections/recommended/?currentJobId=3907890281,,,,,,,,2024-04-26,
277,3891669969,https://www.linkedin.com/jobs/collections/recommended/?currentJobId=3891669969,"Business Analyst - Azure Data Factory Unison Consulting Singapore, Singapore 1 month ago 35 applicants See who Unison Consulting has hired for this role Apply Save Save job Save this job with your existing LinkedIn profile, or create a new one. .  Sign in to save Business Analyst - Azure Data Factory at Unison Consulting . Email or phone Password Show Forgot password? Sign in Report this job Requirement Gathering and Analysis: Collaborate with business stakeholders to understand their data and analytics needs Conduct thorough analysis of business requirements and translate them into technical specifications Azure Data Factory Utilization: Demonstrate expertise in designing and implementing data pipelines using Azure Data Factory Work closely with data engineers and developers to ensure the effective utilization of Azure Data Factory capabilities Data Integration and Management: Develop a comprehensive understanding of data sources, structures, and business rules Facilitate the integration of diverse data sets, ensuring data quality and accuracy Documentation: Create detailed documentation of business requirements, data models, and technical specifications Maintain up-to-date documentation throughout the project lifecycle Collaboration: Act as a liaison between business stakeholders, data engineers, and other technical teams Foster effective communication and collaboration to ensure successful project outcomes Quality Assurance: Conduct testing and validation of data solutions to ensure they meet business requirements Identify and address any issues or discrepancies in data processing Requirements Proven experience as a Business Analyst in a technical environment, with a focus on data and analytics Hands-on experience with Azure Data Factory is essential Strong understanding of data modeling, data warehousing, and ETL processes Familiarity with Agile and Scrum methodologies is a plus Relevant certifications in Azure or business analysis are advantageous Show more Show less Seniority level Mid-Senior level Employment type Full-time Job function Information Technology Industries Technology, Information and Internet Referrals increase your chances of interviewing at Unison Consulting by 2x See who you know",Unison Consulting,Business Analyst - Azure Data Factory,Mid-Senior level,"Singapore, Singapore",1 month ago,35.0,2024-04-26,2024-03-27
278,3867469734,https://www.linkedin.com/jobs/collections/recommended/?currentJobId=3867469734,"Data Analyst (Sales Finance) MANPOWER STAFFING SERVICES (SINGAPORE) PTE LTD Singapore, Singapore 1 month ago Be among the first 25 applicants Apply Join or sign in to find your next job Join to apply for the Data Analyst (Sales Finance) role at MANPOWER STAFFING SERVICES (SINGAPORE) PTE LTD Not you? Remove photo First name Last name Email Password (6+ characters) ,  ,  .   Already on LinkedIn? . .  Sign in to save Data Analyst (Sales Finance) at MANPOWER STAFFING SERVICES (SINGAPORE) PTE LTD . Email or phone Password Show Forgot password? Sign in Report this job Role Overview Based in the Sales Finance team, the Data Analyst will becritical to the success of a new project to improve the weekly sales reporting granularity received from the company’s partners. The ideal candidate should be methodical, analytical, able to work with large amounts of data and good at problem solving as well as troubleshooting. Key Tasks Build and maintain a good professional relationship with both internal (IT, Sales, Finance) and external partners of the APAC region. Project manage each onboarding activity through initial assessments, agreement on delivery dates, reporting methods and file testing. Provide prompt feedbacks/responses to conclude a timely cadence of reporting from the Partner in production. Regularly track and communicate the status of your portfolio of partners to onboard. Work methodically to document changes in status and demonstrate the ability to forecast completion dates. Continuous improvement on the overall process for better efficiency. Data analysis where required to ensure good data integrity. Work effectively as a team to cross-train and share ideas to progressively improve the process and implement better efficiency. Requirements Bachelor’s degree in Finance, Mathematics, Information Systems or equivalent. At least 1 year experience in project management, data capture/analysis and/or working with external customers/partners. Possess good MS Excel skills. Knowledge/Familiarity of reporting methods including EDI (electronic data interchange), sFTP (secured File Transfer Protocol), ASIR (Web) and API is preferable but not required. Proactive and determined to drive actions and results to meet deadlines. Excellent verbal and written communication skills. Detail oriented and self-motivated individual, able work independently or in a team. Show more Show less Seniority level Entry level Employment type Full-time Job function Information Technology",,Data Analyst (Sales Finance),Entry level,"Singapore, Singapore",1 month ago,,2024-04-26,2024-03-27
