,Job_ID,url,Job_txt,company,job-title,level,location,posted-time-ago,nb_candidats,scraping_date,posted_date
170,3901309596,https://www.linkedin.com/jobs/collections/recommended/?currentJobId=3901309596,"Senior Data Analyst Study Group Singapore, Singapore 1 week ago 168 applicants See who Study Group has hired for this role Apply Save Save job Save this job with your existing LinkedIn profile, or create a new one. .  Sign in to save Senior Data Analyst at Study Group . Email or phone Password Show Forgot password? Sign in Report this job Direct message the job poster from Study Group Luno Lim Talent Acquisition Lead, APAC & MENA at Study Group JOB OVERVIEW We are seeking a Senior Data Analyst to offer analytics support to crucial business sectors, with a focus on delivering valuable management information and insights to a diverse range of internal and external stakeholders. Key to this position is the capacity to collaborate with stakeholders at various organizational levels, ensuring their needs are transformed into both technical and non-technical outcomes. A vital aspect of the role involves actively contributing to advancing Study Group's transition towards a more data-driven culture, all while supporting data governance initiatives. ABOUT THE ROLE Undertake simple and complex statistical analysis of a variety of different datasets whilst producing (and monitoring) performance measures, modelling scenarios and outcomes as necessary, for a variety of stakeholders across the organisation. This will include internal and external data, and the use of quantitative and qualitative analytics techniques. Data quality checks and screening are often necessary as is the ability to provide quality assurance re: imported data. Derive insights and explain/interpret trends identified, and their implications which can include presenting findings to stakeholders. This will involve preparing and leading on reports and producing suitable metrics which are appropriately benchmarked. An integral component of the role is ensuring that data is fully understood and utilised appropriately, providing further information or context as required, and training end users on new reports and dashboards. Manage and design the reporting environment, working to identifying areas to increase efficiency and automation of processes, whilst establishing and maintaining automated data processes. This will involve working with the Data Architecture Team around the data lake by identifying and revising reporting requirements. Will need to develop and maintain MI/data reports and dashboards. Reports often must be generated from multiple systems and some data integration work will be required. Also there is a responsibility to maintain documentation relating to reports and dashboards. Create appropriate data visualisations, utilising PowerBI, Tableau and other appropriate tools like R, all in service of providing an accessible way to see and understand trends, outliers, and patterns in data. Manage complex data-related projects and the production of data products from their inception to conclusion, including those involving complex data modelling and forecasting. This will include supporting initiatives for data integrity and normalisation. Support adhoc requests for data. Process confidential data and information according to guidelines, with a complete understanding of GDPR and the Data Protection Act and the implications for the work – advising stakeholders as appropriate. Collaborate with colleagues to share knowledge and understanding of data analysis tools and techniques, ensuring effective data utilization. Contribute to discussions on systems, databases, platforms, software, and data tools, particularly concerning data and analytics requirements for new or upgraded systems. Take a lead in promoting improved data literacy within Study Group and contribute to fostering a data culture across the organization. Advocate for enhanced use and management of data at Study Group. ABOUT YOU Undergraduate degree (2:1 or above) from a reputable university or equivalent experience. Preferably holds a master’s or PhD qualification. Extensive experience in a Management Information/Analyst role using Cognos Business Analytics or PowerBI, Tableau, advanced Excel, and SQL. Proven track record of effective collaboration with stakeholders in specialist and technical roles, including IT infrastructure, data, and analytics specialists, as well as senior executives. Demonstrated ability to exercise sound judgment and initiative in managing competing priorities and requirements while ensuring key objectives are met. Ideally experienced with SQL server, Microsoft Azure Data Lake, or Oracle databases and data warehouses. Highly desirable to have experience with Alteryx, R, and/or Python. ABOUT US Study Group is a leading international education provider that is dedicated and passionate about helping students around the world, creating a brighter future and reaching their full potential. With university partnerships and a variety of face-to-face, online, and hybrid study programmes, we are able to provide students with the resources and guidance they need to succeed. Our global network of offices and university partnerships ensure that students receive the best educational services available. Additionally, our Insendi platform enables us to deliver innovative, accessible, and intuitive digital learning experiences with the most advanced digital tools available. ORGANISATIONAL COMPLIANCE Study Group is proud of its high standards in safeguarding and recognises its importance in enabling the best possible student experience and outcomes. For successful applicants, the following checks will be conducted- Criminal Background Check (country-specific), x2 References, ID and Right to Work checks as well as Education Verification. We are proud to be an equal-opportunity employer and we strive to create a diverse and inclusive workplace. We are committed to providing equal opportunities for all individuals, regardless of race, gender, religion, nationality, or any other factor. We believe that the best person for the job should be selected based on skills and experience alone. Your information will be kept confidential and stored securely. Please see our Privacy Policy. Show more Show less Seniority level Associate Employment type Full-time Job function Analyst Industries Education Administration Programs Referrals increase your chances of interviewing at Study Group by 2x See who you know",Study Group,Senior Data Analyst,Associate,"Singapore, Singapore",1 week ago,168.0,2024-04-26,2024-04-19
171,3605003219,https://www.linkedin.com/jobs/collections/recommended/?currentJobId=3605003219,,,,,,,,2024-04-26,
172,3833764159,https://www.linkedin.com/jobs/collections/recommended/?currentJobId=3833764159,"Business Development (Data Analyst) Intern - Revenue Marketing Solutions (Campaigns) Shopee Singapore, Singapore 2 months ago 77 applicants See who Shopee has hired for this role Apply Join or sign in to find your next job Join to apply for the Business Development (Data Analyst) Intern - Revenue Marketing Solutions (Campaigns) role at Shopee Not you? Remove photo First name Last name Email Password (6+ characters) ,  ,  .   Already on LinkedIn? . .  Sign in to save Business Development (Data Analyst) Intern - Revenue Marketing Solutions (Campaigns) at Shopee . Email or phone Password Show Forgot password? Sign in Report this job Job Description Assist in the development of business strategies by using data and statistical analysis to identify package performance, revenue performance, and partners performance Design, develop, and deploy dashboard or tracker to support business requirements using tools such as Excel, Data Studio, or SQL Support the team to launch packages, and partner with the Marketing team to plan the components of the package such as assets, obligations etc Creative and innovative approach to problem solving Requirements Currently pursuing a Bachelor's degree or higher, preferably in Data Science/Data Analytics or any related quantitative field Proficient in Microsoft Excel and SQL, Python skills are a plus Adapts well in a dynamic environment Full-time interns preferred (3-6 months) Part-time interns who can commit at least 3 working days a week are also welcome to apply Show more Show less Seniority level Internship Employment type Full-time Job function Business Development and Sales Industries Technology, Information and Internet Referrals increase your chances of interviewing at Shopee by 2x See who you know",Shopee,Business Development (Data Analyst) Intern - Revenue Marketing Solutions (Campaigns),Internship,"Singapore, Singapore",2 months ago,77.0,2024-04-26,2024-02-26
173,3611210025,https://www.linkedin.com/jobs/collections/recommended/?currentJobId=3611210025,"Fraud Data Analyst Intern - Trust and Safety, Regional Operations (Summer 2024) Shopee Singapore, Singapore 3 months ago Over 200 applicants See who Shopee has hired for this role Apply Join or sign in to find your next job Join to apply for the Fraud Data Analyst Intern - Trust and Safety, Regional Operations (Summer 2024) role at Shopee Not you? Remove photo First name Last name Email Password (6+ characters) ,  ,  .   Already on LinkedIn? . .  Sign in to save Fraud Data Analyst Intern - Trust and Safety, Regional Operations (Summer 2024) at Shopee . Email or phone Password Show Forgot password? Sign in Report this job Job Description Apply investigational skills to monitor, audit, and analyse potential fraudulent cases and produce root cause analysis Utilise data tools to design data-driven strategies for fraud prevention and detection Understand the trends and intelligence of fraudulent activities in each local market Communicate findings to key stakeholders and manage timeline of projects Maintain regular fraud reporting, to define and improve key performance metrics Requirements Currently pursuing a diploma/degree in Business, Engineering or relevant disciplines Excellent communication skills (written and verbal) Ability to use SQL or Python to process and analyze data Strong data analysis and correlation skills to mine the characteristics of different scenarios from complex data sets, is a strong plus Full time interns (6 months with LOA) is preferred Part time interns (min 3 days a week) are also welcome to apply Show more Show less Seniority level Internship Employment type Full-time Job function Information Technology Industries Technology, Information and Internet Referrals increase your chances of interviewing at Shopee by 2x See who you know",Shopee,"Fraud Data Analyst Intern - Trust and Safety, Regional Operations (Summer 2024)",Internship,"Singapore, Singapore",3 months ago,,2024-04-26,2024-01-27
174,3908134704,https://www.linkedin.com/jobs/collections/recommended/?currentJobId=3908134704,"Senior Data Engineer x Analyst QCP Singapore, Singapore 3 days ago Over 200 applicants See who QCP has hired for this role Apply Save Save job Save this job with your existing LinkedIn profile, or create a new one. .  Sign in to save Senior Data Engineer x Analyst at QCP . Email or phone Password Show Forgot password? Sign in Report this job Established in 2017, QCP is one of the first digital asset trading firms in Singapore, with a vision to partner the next generation of investors to unlock institutional opportunities in digital assets. QCP brings to clients deep expertise gained from thriving through multiple market cycles. A global market maker in digital asset derivatives with a vast network of liquidity providers and counterparties, we are shaping the future of digital asset markets through greater access and efficiency. We offer a range of tailored derivatives and spot trading as well as structured solutions to institutional, professional and accredited investors. We also provide 24/7 liquidity across various markets in partnership with various exchanges and platforms. QCP is headquartered in Singapore and is supported by a strong team of professionals in trading, business development, operations, risk and compliance teams. Our in-house publications track the constantly evolving state of digital assets and markets, and can be accessed on our Telegram (t.me/QCPbroadcast), website (qcpgroup.com), Twitter (@qcpgroup) and LinkedIn. Are you a data expert with a keen interest in AI/ML? We're seeking a Senior Data Engineer x Analyst who is passionate about leveraging data to drive strategic decision-making. In this role, you'll have the exciting opportunity to architect the future of our data infrastructure and analytics solutions. Responsibilities Design, construct, install, test, and maintain data management systems Ensure systems meet business requirements and industry practices Integrate up-and-coming data management and software engineering technologies into existing data infrastructures Develop and implement advanced statistical techniques to solve complex problems, extract actionable insights to drive data-driven decisions, and improve processes to achieve business goals. Translate business requirements into data modeling and visualization, build data pipelines if necessary Utilize AWS cloud services for efficient data handling and analytics, propose usage of data warehouse, and business intelligence tools, and integrate with existing platforms and workflows Requirements At least 3 years of experience working in a relevant role Bachelor's or MSc from a renowned University in a related field Proven experience in data analysis and pipeline construction; Experience with big data tools (Hadoop, Spark, Kafka, etc.) Strong knowledge of AWS cloud services and database technologies Proficient in SQL, Python, and other programming languages Excellent analytical skills to work on complex, cross-functional projects Ability to translate business requirements into non-technical and technical terms Bonus: Design, develop, and operate data pipelines to provide high-quality datasets for analytical and AI/ML use cases Demonstrate a strong numerical aptitude and a comfort level working with extensive datasets Benefits The Environment We Offer As a growing firm with a tightly-knit team, we respect and listen to all our employees. You will get the chance to make an impact by having your voice heard by everyone, including the management. Our employees enjoy a high level of autonomy at work. We focus on substance, not form - as long as you can perform, you will be recognized and rewarded. We are also dedicated to supporting our staff and ensuring they develop holistically to maximize their potential in the long- term. We also provide flexible working arrangement as required and a casual and fun environment to boot! Show more Show less Seniority level Mid-Senior level Employment type Full-time Job function Information Technology Industries Financial Services Referrals increase your chances of interviewing at QCP by 2x See who you know",QCP,Senior Data Engineer x Analyst,Mid-Senior level,"Singapore, Singapore",3 days ago,,2024-04-26,2024-04-23
175,3773267246,https://www.linkedin.com/jobs/collections/recommended/?currentJobId=3773267246,,,,,,,,2024-04-26,
176,3837194349,https://www.linkedin.com/jobs/collections/recommended/?currentJobId=3837194349,"Business Intelligence Analyst - Business Intelligence, Cross Border Shopee Singapore, Singapore 2 months ago 125 applicants See who Shopee has hired for this role Apply Join or sign in to find your next job Join to apply for the Business Intelligence Analyst - Business Intelligence, Cross Border role at Shopee Not you? Remove photo First name Last name Email Password (6+ characters) ,  ,  .   Already on LinkedIn? . .  Sign in to save Business Intelligence Analyst - Business Intelligence, Cross Border at Shopee . Email or phone Password Show Forgot password? Sign in Report this job About The Team The Business Intelligence and Data Analytics team plays a critical role in conducting close-loop data-driven business iterations. As business intelligence specialists and data analysts, our scope of work is not limited to just performance monitoring and reporting, but also in proactively finding actionable insights to help drive high-impact business changes. Our end-to-end data solution reduces the gap between the business teams and technical teams, and achieves real ‘intelligence’ in the iteration cycle. Browse our Business Intelligence and Data Analytics team openings to see how you can make an impact with us. Job Description Conduct thorough analysis to identify trends, patterns, and opportunities for Shopee cross border business organisation Collaborate with stakeholder teams to define key performance indicators (KPIs) and develop metrics that align with business objectives Lead cross-functional teams' data analytics projects Create, monitor and optimise reporting flow using BI tools from back-end to front-end Maintain data integrity and streamline data processes Gather business requirements to develop small to medium size tools or simulation models in helping business to achieve quick and important goals Requirements Bachelor’s/Master Degree, preferably in data analytics, engineering, statistics, mathematics or any other quantitative discipline 2-5 years of experience in business intelligence, data analytics, engineering or any other related fields Proven technical skills: SQL, Spark, Python etc. Experience in data analysis and process automation preferred Able to pay attention to detail and rely on data Able to story tell and transform numbers into key insights that drives business decisions Able to communicate in a clear and succinct manner to stakeholders Able to identify root causes and solve challenges Growth and Optimisation mindsets Show more Show less Seniority level Mid-Senior level Employment type Full-time Job function Research, Analyst, and Information Technology Industries Technology, Information and Internet Referrals increase your chances of interviewing at Shopee by 2x See who you know",Shopee,"Business Intelligence Analyst - Business Intelligence, Cross Border",Mid-Senior level,"Singapore, Singapore",2 months ago,125.0,2024-04-26,2024-02-26
177,3903022511,https://www.linkedin.com/jobs/collections/recommended/?currentJobId=3903022511,"Assoc Eng Failure Analysis GlobalFoundries Singapore 1 week ago 37 applicants See who GlobalFoundries has hired for this role Apply Join or sign in to find your next job Join to apply for the Assoc Eng Failure Analysis role at GlobalFoundries Not you? Remove photo First name Last name Email Password (6+ characters) ,  ,  .   Already on LinkedIn? . .  Sign in to save Assoc Eng Failure Analysis at GlobalFoundries . Email or phone Password Show Forgot password? Sign in Report this job Introduction to GlobalFoundries GlobalFoundries (GF) is one of the world’s leading semiconductor foundries and the only one with a truly global footprint spanning three continents. We manufacture complex, feature-rich integrated circuits that enable billions of electronic devices. At GF, we make things that matter — from the solutions that enable the way we live today, to the technologies that drive what’s possible for tomorrow. Join us in changing the industry that is changing the world. For more information, visit www.gf.com. Essential Duties And Responsibilities You will be responsible but not limited for the following tasks: Perform FIB (Focused-ion beam) milling for TEM sample preparation and failure analysis on various Tech-node IC devices for line process monitoring, yield improvement and new product development. Perform on basic TEM imaging and measurement requests. Work in FA lab environment and conduct pre-FIB related works such as sample delayering and coating. Comply with Lab EHS and safety rules and collaborate with Lab team on the lab housekeeping/audits. Work in night shift. Requirements Successful candidates for this position shall have: Diploma in Electronics Engineering or related subjects. Prior experience with SEM/FIB is not compulsory but preferred. Training will be provided. Basic knowledge on semiconductor devices and manufacturing processes. Solid communication, fast learning, and problem-solving skills. Passionate on IC failure analysis with team spirit. Team player with sense of urgency and commitment. GLOBALFOUNDRIES is an equal opportunity employer, cultivating a diverse and inclusive workforce. We believe having a multicultural workplace enhances productivity, efficiency, and innovation whilst our employees feel truly respected, valued and heard. As an affirmative employer, all qualified applicants are considered for employment regardless of age, ethnicity, marital status, citizenship, race, religion, political affiliation, gender, sexual orientation and medical and/or physical abilities. All offers of employment with GLOBALFOUNDRIES are conditioned upon the successful completion of background checks, and medical screenings, as applicable and subject to the respective local laws and regulations. To ensure that we maintain a safe and healthy workplace for our GlobalFoundries employees, please note that offered candidates who have applied for jobs in Singapore will have to be fully vaccinated prior to their targeted start date. For new hires, the appointment is contingent upon the provision of a copy of their COVID-19 vaccination document, subject to any written request for medical or religious accommodation. Information about our benefits you can find here: https://gf.com/about-us/careers/opportunities-asia Show more Show less Seniority level Entry level Employment type Full-time Job function Information Technology Industries Appliances, Electrical, and Electronics Manufacturing, IT Services and IT Consulting, and Software Development Referrals increase your chances of interviewing at GlobalFoundries by 2x See who you know",GlobalFoundries,Assoc Eng Failure Analysis,Entry level,Singapore,1 week ago,37.0,2024-04-26,2024-04-19
178,3899223640,https://www.linkedin.com/jobs/collections/recommended/?currentJobId=3899223640,"Senior Data Analyst, Regional BI & Planning Shopee Singapore, Singapore 1 week ago 84 applicants See who Shopee has hired for this role Apply Join or sign in to find your next job Join to apply for the Senior Data Analyst, Regional BI & Planning role at Shopee Not you? Remove photo First name Last name Email Password (6+ characters) ,  ,  .   Already on LinkedIn? . .  Sign in to save Senior Data Analyst, Regional BI & Planning at Shopee . Email or phone Password Show Forgot password? Sign in Report this job Job Description Gather business requirements from different functional teams and translate them into suitable data tasks Extract and process large volume of data to meet business requirements Work with various partner teams to ensure data accuracy and integrity Proactively engage with stakeholders to perform data analysis for different business cases Think on your feet to troubleshoot issues with robust problem-solving structure Convert ambiguous business problems into concrete questions and hypothesis to be solved using data-driven multi-disciplinary problem solving Provide useful technical expertise and data insights to help shape business strategy Requirements Bachelor's degree or higher in Information science, Engineering, Business Analytics, Statistics, Mathematics, or related field Highly proficient in Excel and hands-on experience with large amounts of data using SQL, Python, and/or Spark Strong analytical skills with work experience in data-driven analysis under pressure Outstanding in interpersonal communications Able to make analytical recommendations and provide business insights to the senior management Experience in e-Commerce or the internet industry preferred Show more Show less Seniority level Mid-Senior level Employment type Full-time Job function Information Technology Industries Technology, Information and Internet Referrals increase your chances of interviewing at Shopee by 2x See who you know",Shopee,"Senior Data Analyst, Regional BI & Planning",Mid-Senior level,"Singapore, Singapore",1 week ago,84.0,2024-04-26,2024-04-19
179,3879810224,https://www.linkedin.com/jobs/collections/recommended/?currentJobId=3879810224,,,,,,,,2024-04-26,
