job_id,titles,teasers,companies,locations,categorys,subCategories,job_types,salaries,dateposted,datedisplay,url
75419282,People Ops Partner (Data Analytics & Ops),We are looking for People Ops Partner (Data Analytics & Ops) to join us.,Assurity Trusted Solutions Pte Ltd,Central Region,Human Resources & Recruitment,Consulting & Generalist HR,Contract/Temp,,2024-04-26T00:53:28Z,11h ago,https://www.jobstreet.com.sg/job/75419282
75375824,"Manager, SIT Teaching and Learning Academy (Data Analytics)",-,Singapore Institute of Technology,Central Region,Information & Communication Technology,Database Development & Administration,Full time,,2024-04-24T04:02:19Z,2d ago,https://www.jobstreet.com.sg/job/75375824
75429435,Data Analyst,-,Private Advertiser,North-East Region,Information & Communication Technology,Business/Systems Analysts,Full time,,2024-04-26T06:31:15Z,5h ago,https://www.jobstreet.com.sg/job/75429435
75368539,"Intern, Data Analytics, Disney+ - Jul to Dec 2024","The Data Analytics Intern supports the teams in all analytics functions behind all user growth initiatives and help monitor and optimize program, c...",The Walt Disney Company (APAC),Central Region,Marketing & Communications,Marketing Communications,Full time,,2024-04-23T12:12:00Z,2d ago,https://www.jobstreet.com.sg/job/75368539
75386609,"Senior/ Analyst, Data Science, Group Finance Analytics (Contract)","You will champion the development of new data science techniques, methodologies and delivery of analytics projects.",Singapore Health Services Pte Ltd (SingHealth HQ),Central Region,Science & Technology,"Mathematics, Statistics & Information Sciences",Contract/Temp,,2024-04-24T09:25:01Z,2d ago,https://www.jobstreet.com.sg/job/75386609
75436146,CRO Data Analyst (Graduate Analyst),"The Data Analyst supports the CRO division with data analysis and technology expertise - in developing and maintaining reporting capabilities, buil...",SCB-JULIUS BAER (SINGAPORE) PTE. LTD.,Central Region,Banking & Financial Services,Analysis & Reporting,Contract/Temp,,2024-04-26T05:59:00Z,5h ago,https://www.jobstreet.com.sg/job/75436146
75367548,"Senior Data Analyst, O&T Quality Assurance - Innovation and Analytics (AVP/C12)","The O&T Quality Assurance (QA) in O&T’s COO function and is responsible to provide strong oversight, facilitate reviews and support Citi’s effectiv...",Citibank N.A.,Central Region,Information & Communication Technology,Testing & Quality Assurance,Full time,,2024-04-23T16:55:00Z,2d ago,https://www.jobstreet.com.sg/job/75367548
75321199,"Data Analyst - Marketing Analytics, Regional Brand & Growth Marketing",-,SHOPEE SINGAPORE PRIVATE LIMITED,Central Region,Marketing & Communications,Marketing Communications,Full time,,2024-04-22T07:53:08Z,4d ago,https://www.jobstreet.com.sg/job/75321199
75339613,"Manager, Group Care Plan Operations, Data Analytics & Insights(6318)",-,NUHS Group Ops & IT,Central Region,Marketing & Communications,Market Research & Analysis,Full time,,2024-04-23T02:14:32Z,3d ago,https://www.jobstreet.com.sg/job/75339613
75380977,Lecturer/Diploma in Big Data & Analytics,"Lecturer in School of Informatics & IT (Diploma in Big Data & Analytics)
[What you will be working on]
• Conduct lessons and carry out all relevant...",Public Service Division,Central Region,Education & Training,Teaching - Tertiary,Full time,,2024-04-24T02:31:00Z,2d ago,https://www.jobstreet.com.sg/job/75380977
75407589,"Post Doctoral Fellow (Laboratory of Systems Biology & Data Analytics), GIS",We are looking for team members who will develop cutting-edge AI/machine learning methods and pipelines to integrate and interrogate gene expressio...,A*STAR Research Entities (A*STAR),Central Region,Science & Technology,Laboratory & Technical Services,Contract/Temp,,2024-04-25T06:21:00Z,1d ago,https://www.jobstreet.com.sg/job/75407589
75432817,Data Analyst (Petrochemicals | Oil & Gas | Data Models | SQL| Cloud Data),"Collaborate with the cross functional teams to comprehend department, individual data requirements, use-case specific.",Talent Trader Group Pte Ltd,Central Region,Information & Communication Technology,Database Development & Administration,Full time,,2024-04-26T08:34:27Z,3h ago,https://www.jobstreet.com.sg/job/75432817
75436078,Data Scientist - DBSG,"As a Data Scientist, you will analyse complex data to extract actionable insights that will inform company strategy and decision-making. You will b...",Hyperscal Solutions,West Region,Science & Technology,"Mathematics, Statistics & Information Sciences",Full time,,2024-04-26T06:01:00Z,5h ago,https://www.jobstreet.com.sg/job/75436078
75433755,Data Analyst  (Commodities Trading),Import data from various external and internal sources to bring meaningful insights into the business.,Talent Trader Group Pte Ltd,Central Region,Information & Communication Technology,Business/Systems Analysts,Full time,"$5,000 – $7,000 per month",2024-04-26T09:08:07Z,2h ago,https://www.jobstreet.com.sg/job/75433755
75426925,Data Scientist,"* Major Foreign-Based Manufacturing Organisation in Singapore
* Key Data Role in Singapore
* Employee-Centric Environment",Hudson Global Resources ( HQ ),Central Region,Information & Communication Technology,Engineering - Software,Full time,,2024-04-26T05:12:49Z,6h ago,https://www.jobstreet.com.sg/job/75426925
75386522,"Principal Analyst, Group Finance Analytics","You will provide technical advisory to the analysts, establishing data analytics support.",Singapore Health Services Pte Ltd (SingHealth HQ),Central Region,Science & Technology,"Mathematics, Statistics & Information Sciences",Full time,,2024-04-24T09:24:02Z,2d ago,https://www.jobstreet.com.sg/job/75386522
75340009,Data Analyst,"Unleash insights as a Data Analyst! Dive into data, drive decisions, and fuel innovation with us. Join now!",NEO GARDEN CATERING PTE. LTD.,West Region,Science & Technology,"Mathematics, Statistics & Information Sciences",Full time,,2024-04-23T02:26:32Z,3d ago,https://www.jobstreet.com.sg/job/75340009
75344816,Business Risk Specialist  Data Analytics & Sampling - Singapore,You'll be working in the Wealth Management Asia Pacific (WM APAC) Regional Business Risk Organization Control Framework Team. We support the WM APAC,Hays Specialist Recruitment Pte Ltd,Central Region,Banking & Financial Services,Banking - Corporate & Institutional,Contract/Temp,$5000.0 - $10000.0 p.m. + Attractive salary & care,2024-04-23T04:20:31Z,3d ago,https://www.jobstreet.com.sg/job/75344816
75302666,Information Technology - Senior Data Engineer (Analytics Engineering Track),"We have multiple senior data engineering positions available. The Data Analytics Engineer is responsible for designing and developing robust, scala...",Singapore Airlines,East Region,Science & Technology,"Mathematics, Statistics & Information Sciences",Full time,,2024-04-21T14:39:00Z,4d ago,https://www.jobstreet.com.sg/job/75302666
75414351,Data Analyst (Entry level),"Be able to spot patterns and trends in our data, generate insights and hypotheses, and propose solutions to address business or product problems.
B...",Carousell Pte Ltd,Central Region,Information & Communication Technology,Business/Systems Analysts,Full time,,2024-04-25T16:19:00Z,19h ago,https://www.jobstreet.com.sg/job/75414351
75410701,Data Scientist - DBSG,"As a Data Scientist, you will analyse complex data to extract actionable insights that will inform company strategy and decision-making. You will b...",Beyondsoft International (Singapore) Pte Ltd,Central Region,Science & Technology,"Mathematics, Statistics & Information Sciences",Full time,,2024-04-25T09:44:00Z,1d ago,https://www.jobstreet.com.sg/job/75410701
75367936,Data Analyst,"4e Exchange, a leading financial derivatives trading platform, is seeking a Senior Data Analyst to join our team. As a global leader in the financi...",4e,Central Region,Banking & Financial Services,Analysis & Reporting,Full time,,2024-04-23T13:13:00Z,2d ago,https://www.jobstreet.com.sg/job/75367936
75332524,Data Analyst,"Job Description: As a Data Analyst, you will play a crucial role in leveraging data to drive business insights and decision-making. Your primary re...",JCO ANALYTICS PTE. LTD.,Central Region,Science & Technology,"Mathematics, Statistics & Information Sciences",Contract/Temp,,2024-04-22T14:15:00Z,3d ago,https://www.jobstreet.com.sg/job/75332524
75354759,Data Analyst (Phillip Nova),"Proficiency in data manipulation and analysis tools. Strong data visualization skills using tools such as Tableau, Power BI, or others.",Phillip Nova Pte Ltd,Central Region,Science & Technology,"Mathematics, Statistics & Information Sciences",Full time,,2024-04-23T10:04:26Z,3d ago,https://www.jobstreet.com.sg/job/75354759
75355995,HR Dashboard & Analytics Executive | Up to $3500 | 6 months,-,PERSOLKELLY Singapore Pte Ltd (Formerly Kelly Services Singapore Pte Ltd),Central Region,Human Resources & Recruitment,Organisational Development,Contract/Temp,"$3,000 – $3,500 per month",2024-04-23T13:50:37Z,2d ago,https://www.jobstreet.com.sg/job/75355995
75383958,"Senior VP, Lead TDM, Platform Engineering, Data Analytics Technology",-,United Overseas Bank Limited (UOB),Central Region,Information & Communication Technology,Engineering - Software,Full time,,2024-04-24T07:57:28Z,2d ago,https://www.jobstreet.com.sg/job/75383958
75329590,"VP, Financial Strategy (Data Analytics, Programming), Group Finance",We support enhanced decision-making to achieve optimal and sustainable financial outcomes for our shareholders. We are responsible for providing in...,United Overseas Bank Limited (UOB),Central Region,Banking & Financial Services,Analysis & Reporting,Full time,,2024-04-22T12:59:00Z,3d ago,https://www.jobstreet.com.sg/job/75329590
75423870,Data Scientist (Tuas South),The candidate should have the skills to capture the requirements from customer and work closely with onsite and offshore team members.,QUEST GLOBAL SERVICES PTE LTD,West Region,Engineering,Electrical/Electronic Engineering,Contract/Temp,"$3,500 – $5,000 per month",2024-04-26T03:27:31Z,8h ago,https://www.jobstreet.com.sg/job/75423870
75367912,Manager / Assistant Senior Manager (Data Analytics),"As a data analyst in our Internal Audit Team, you are involved in the design and performance of data analytics tests to support OIA’s continuous mo...",Yale-NUS College,Central Region,Banking & Financial Services,Analysis & Reporting,Full time,,2024-04-18T12:00:00Z,7d ago,https://www.jobstreet.com.sg/job/75367912
75319768,Data Analyst,You will be given good learning exposure.,Methodist Welfare Services,West Region,Healthcare & Medical,Clinical/Medical Research,Full time,,2024-04-22T07:05:05Z,4d ago,https://www.jobstreet.com.sg/job/75319768
75436481,Senior Data Scientist (Contract),"As a DAE Senior Data Scientist, you will be working in a fast-paced environment that would require the ability to manage multiple priorities and ne...",Monetary Authority of Singapore (MAS),Central Region,Science & Technology,"Mathematics, Statistics & Information Sciences",Contract/Temp,,2024-04-26T05:54:00Z,6h ago,https://www.jobstreet.com.sg/job/75436481
75246968,"Data Analytics Intern - Business Intelligence, Regional Operations",-,SHOPEE SINGAPORE PRIVATE LIMITED,Central Region,Information & Communication Technology,Business/Systems Analysts,Full time,,2024-04-19T01:42:39Z,7d ago,https://www.jobstreet.com.sg/job/75246968
75230897,"Data Analyst Intern - Regional Marketing Analytics, Regional Brand & Growth Mark",-,SHOPEE SINGAPORE PRIVATE LIMITED,Central Region,Marketing & Communications,Market Research & Analysis,Full time,,2024-04-18T08:38:37Z,8d ago,https://www.jobstreet.com.sg/job/75230897
75252891,"Data Analytics Lead, Regional Business Intelligence & Planning",--,SHOPEE SINGAPORE PRIVATE LIMITED,Central Region,Information & Communication Technology,Business/Systems Analysts,Full time,,2024-04-19T02:57:09Z,7d ago,https://www.jobstreet.com.sg/job/75252891
75239580,Data Analytics Audit Specialist,"Develop and implement data analytics strategies to enhance audit procedures and methodologies, incorporating emerging technologies and best practic...",Central Provident Fund Board,Central Region,Accounting,Audit - Internal,Contract/Temp,,2024-04-18T14:50:00Z,7d ago,https://www.jobstreet.com.sg/job/75239580
75402740,Summer Intern - Business Insight,"3-months summer internship to support our business insight strategic project, you will be based in The JTC Summit regional office.",West Pharmaceutical Services Singapore Pte Ltd,West Region,Consulting & Strategy,Analysts,Full time,"$1,800 – $2,000 per month",2024-04-25T06:12:52Z,1d ago,https://www.jobstreet.com.sg/job/75402740
75427792,Data Analyst (1Year contract) Gov Board,"Looking for Data Analyst to join on a 1-year contract basis. Responsible for collecting, analyzing, and interpreting data,to drive business decisions.",PERSOLKELLY Singapore Pte Ltd (Formerly Kelly Services Singapore Pte Ltd),West Region,Information & Communication Technology,Business/Systems Analysts,Full time,"$4,000 – $4,500 per month",2024-04-26T05:54:16Z,6h ago,https://www.jobstreet.com.sg/job/75427792
75328756,HR Dashboard & Analytics Executive | Up to $3500 | 6 months (renewable),-,PERSOLKELLY Singapore Pte Ltd (Formerly Kelly Services Singapore Pte Ltd),Central Region,Human Resources & Recruitment,Other,Contract/Temp,"$3,000 – $3,500 per month",2024-04-22T15:26:17Z,3d ago,https://www.jobstreet.com.sg/job/75328756
75419731,Data Analyst / Up to S$4500 / West / 1 year contract,"Looking for Data Analyst to join on a 1-year contract basis. Responsible for collecting, analyzing, and interpreting data,to drive business decisions.",PERSOLKELLY Singapore Pte Ltd (Formerly Kelly Services Singapore Pte Ltd),West Region,Information & Communication Technology,Networks & Systems Administration,Full time,"$4,000 – $4,500 per month",2024-04-26T01:10:45Z,10h ago,https://www.jobstreet.com.sg/job/75419731
75272900,Strategy and Operations Data Analytics Intern - Shopee Xpress Last Mile,"The Operation teams at Shopee covers the operational end-to-end process, from when the buyer searches for a product listed on the Shopee platform...",SHOPEE SINGAPORE PRIVATE LIMITED,Singapore,Information & Communication Technology,Business/Systems Analysts,Contract/Temp,,2024-04-19T07:39:07Z,7d ago,https://www.jobstreet.com.sg/job/75272900
75414400,"Intern, SCM Data Analyst","Coordinate projects and activities in supporting the department, using finance systems, metrics/data management and analysis
Support superior in ma...",DKSH Singapore Pte Ltd,Central Region,Banking & Financial Services,Analysis & Reporting,Full time,,2024-04-25T15:09:00Z,20h ago,https://www.jobstreet.com.sg/job/75414400
75404466,"Head, Data","The Head, Data will play a key role in supporting the Director in developing data analytics and AI strategy and initiatives.",Thomson Medical Pte Ltd,Central Region,Information & Communication Technology,Management,Full time,,2024-04-25T07:11:46Z,1d ago,https://www.jobstreet.com.sg/job/75404466
75227200,Analytics Developer/Data Engineer,"2. What we are looking for
· Good understanding and completion of projects using waterfall/Agile methodology.
· Strong SQL, data modelling and data...",PHOENIX SOLUTIONS (S) PTE. LTD.,East Region,Information & Communication Technology,Engineering - Software,Full time,,2024-04-18T02:42:00Z,8d ago,https://www.jobstreet.com.sg/job/75227200
75207576,Administrator (Data Analytics),"Interested to explore into Data Analytics function
Organized and meticulous to assist team on administration",IHH Healthcare,Central Region,Administration & Office Support,Administrative Assistants,Full time,,2024-04-17T15:55:00Z,8d ago,https://www.jobstreet.com.sg/job/75207576
75383926,"Manager, Marketing Data Analyst (6412)",-,Changi Airport Group (Singapore) Pte. Ltd.,Central Region,Marketing & Communications,Management,Full time,,2024-04-24T07:56:18Z,2d ago,https://www.jobstreet.com.sg/job/75383926
75429852,Data Scientist - Digital Transformation Office,"As a Data Scientist in Digital Transformation Office @ NYP, you will be at the forefront of shaping the future of data and AI-driven decision-makin...",Public Service Division,Central Region,Science & Technology,"Mathematics, Statistics & Information Sciences",Full time,,2024-04-26T03:26:00Z,8h ago,https://www.jobstreet.com.sg/job/75429852
75308328,Data Analyst - ShopeePay,-,SHOPEE SINGAPORE PRIVATE LIMITED,Central Region,Information & Communication Technology,Business/Systems Analysts,Full time,,2024-04-22T02:05:55Z,4d ago,https://www.jobstreet.com.sg/job/75308328
75318241,Data Scientist,"As a Data Scientist, you will be at the forefront of our data analytics efforts, working closely with cross-functional teams to develop and deploy ...",CPO PTE. LTD.,Central Region,Science & Technology,"Mathematics, Statistics & Information Sciences",Full time,,2024-04-22T02:09:00Z,4d ago,https://www.jobstreet.com.sg/job/75318241
75226861,Data Scientist and Analytics Specialist,"Responsible for enabling decision making by exploring the data, recommending actionable insights, and building visualizations, dashboards.
Packages...",Philips Domestic Appliances Singapore Pte. Ltd.,Central Region,Sales,New Business Development,Full time,,2024-04-18T02:39:00Z,8d ago,https://www.jobstreet.com.sg/job/75226861
75328324,"HR Dashboard & Analytics Executive (6 months) | Up $3,500","Executive (HR Dashboard and Analytics)	
Chinatown
6 months (w option to extend)",PERSOLKELLY Singapore Pte Ltd (Formerly Kelly Services Singapore Pte Ltd),Central Region,Human Resources & Recruitment,Consulting & Generalist HR,Contract/Temp,"$3,000 – $3,500 per month",2024-04-22T13:43:35Z,3d ago,https://www.jobstreet.com.sg/job/75328324
75191422,Internship - Data Analytics (BE Industrial Engineering),"Does this sound like just the right challenge for you? If so, we look forward to getting to know you!",Infineon Technologies,Central Region,Information & Communication Technology,Business/Systems Analysts,Contract/Temp,,2024-04-17T05:52:55Z,9d ago,https://www.jobstreet.com.sg/job/75191422
75341640,Data Architect Analyst (6 months internship),-,"Mizuho Bank, Ltd",Central Region,Information & Communication Technology,Database Development & Administration,Full time,,2024-04-23T03:10:47Z,3d ago,https://www.jobstreet.com.sg/job/75341640
75191095,"Internship - ATV Supply Chain Planner, Data Analytics","Does this sound like just the right challenge for you? If so, we look forward to getting to know you!",Infineon Technologies,Central Region,Information & Communication Technology,Database Development & Administration,Contract/Temp,,2024-04-17T05:40:47Z,9d ago,https://www.jobstreet.com.sg/job/75191095
75206179,Data Analyst,"Responsible for delivering, standardizing and automating data analytic reports, notifications and dashboards.
Job Requirements:
Degree in Computer ...",D L Resources Pte Ltd,Central Region,Information & Communication Technology,Business/Systems Analysts,Contract/Temp,,2024-04-17T13:40:00Z,8d ago,https://www.jobstreet.com.sg/job/75206179
75401597,"Data Analyst - 1 year contract/ Up to $4,500","data analyst, strong in statics, Power BI, Microsoft 365",Forte Employment Services Pte Ltd,Central Region,Science & Technology,"Mathematics, Statistics & Information Sciences",Contract/Temp,"$3,500 – $4,500 per month",2024-04-25T04:42:52Z,1d ago,https://www.jobstreet.com.sg/job/75401597
75203101,Data Analyst,"Job Roles:Regular data mining, transformation, visualization, analytics and reporting worksCoordinate with various internal and external technology...",D L Resources Pte Ltd,Singapore,Information & Communication Technology,Business/Systems Analysts,Contract/Temp,,2024-04-17T10:13:54Z,9d ago,https://www.jobstreet.com.sg/job/75203101
75368930,"AVP, Data Analyst, Business Performance, Consumer Banking Group",Refer a friend Submit a candidate's profile,DBS Bank Limited,Central Region,Accounting,Analysis & Reporting,Full time,,2024-04-23T05:01:00Z,3d ago,https://www.jobstreet.com.sg/job/75368930
75182689,Administrator (Data Analytics),Data Analysis and prepare reports  Manage calendar for VP and the team Schedule and prepare claims submission,IHH Healthcare,Central Region,Administration & Office Support,Administrative Assistants,Full time,,2024-04-17T01:35:50Z,9d ago,https://www.jobstreet.com.sg/job/75182689
75419359,College Intern - Partner Account Operation Data Analyst,"Develop a 1 stop portal & quick guide for Partner account operations manager and partners on most used sales ops processes and tools.
Analyze partn...",Hewlett Packard Enterprise,West Region,Science & Technology,"Mathematics, Statistics & Information Sciences",Full time,,2024-04-25T21:39:00Z,14h ago,https://www.jobstreet.com.sg/job/75419359
75238768,Senior Data Analyst,We are seeking an experienced Senior Data Analyst to join our dynamic Data Analytics & Insights team. The ideal candidate will have a solid foundat...,Net6tem,Central Region,Information & Communication Technology,Business/Systems Analysts,Contract/Temp,,2024-04-18T14:52:00Z,7d ago,https://www.jobstreet.com.sg/job/75238768
75150563,"Senior Executive / Assistant Manager, Data Analytics & Insights(5861)",-,NUHS Group Ops & IT,Central Region,Hospitality & Tourism,Management,Full time,,2024-04-16T02:11:03Z,10d ago,https://www.jobstreet.com.sg/job/75150563
75320644,Data Science Engineer - (Python),To develop models and work with various in-house stakeholders in the manufacturing industry.,GMP Group HQ,West Region,Information & Communication Technology,Management,Full time,"$4,000 – $4,800 per month",2024-04-22T07:32:53Z,4d ago,https://www.jobstreet.com.sg/job/75320644
75148974,Administrator (Data Analytics),The Role Key accountabilities Data Analysis and prepare reports  Project Management Manage calendar for VP and the team Schedule and coordin,IHH Healthcare,Central Region,Administration & Office Support,Administrative Assistants,Full time,,2024-04-16T01:21:03Z,10d ago,https://www.jobstreet.com.sg/job/75148974
75252728,Data Analyst - SeaMoney Credit,-,SHOPEE SINGAPORE PRIVATE LIMITED,Central Region,Banking & Financial Services,Analysis & Reporting,Full time,,2024-04-19T02:52:06Z,7d ago,https://www.jobstreet.com.sg/job/75252728
75371604,Data Science Analyst / Senior Data Science Analyst,Data Science Analyst / Senior Data Science Analyst,PSA Corporation Limited,Central Region,Science & Technology,"Mathematics, Statistics & Information Sciences",Full time,,2024-04-24T03:20:18Z,2d ago,https://www.jobstreet.com.sg/job/75371604
75243684,"Data Analyst, Planning & Budgeting - SG Warehouse",The Business Intelligence and Data Analytics team plays a critical role in conducting close-loop data-driven business iterations. As business...,SHOPEE SINGAPORE PRIVATE LIMITED,Singapore,"Manufacturing, Transport & Logistics",Analysis & Reporting,Full time,,2024-04-19T00:54:48Z,7d ago,https://www.jobstreet.com.sg/job/75243684
75276585,Data Analyst (Data Models| SQL | Cloud Data) - West,"Collaborate with the cross functional teams to comprehend department, individual data requirements, use-case specific.",Talent Trader Group Pte Ltd,Central Region,Information & Communication Technology,Database Development & Administration,Full time,,2024-04-19T08:14:14Z,7d ago,https://www.jobstreet.com.sg/job/75276585
75242491,Regional Operations Data Analyst,--,SHOPEE SINGAPORE PRIVATE LIMITED,Central Region,Science & Technology,"Mathematics, Statistics & Information Sciences",Full time,,2024-04-19T00:23:25Z,7d ago,https://www.jobstreet.com.sg/job/75242491
75437356,Data Management Lead/ Data Analyst (Group IT),Join our Talent Community,Far East Organization,North Region,Information & Communication Technology,Business/Systems Analysts,Full time,,2024-04-26T09:55:59Z,2h ago,https://www.jobstreet.com.sg/job/75437356
75217932,Senior Data Analyst - Marketplace Product,--,SHOPEE SINGAPORE PRIVATE LIMITED,Central Region,Science & Technology,"Mathematics, Statistics & Information Sciences",Full time,,2024-04-18T02:23:51Z,8d ago,https://www.jobstreet.com.sg/job/75217932
75137646,"Manager, SIT Teaching and Learning Academy (Data Analytics)",We are looking for an educational data analyst to join our team (SIT Teaching & Learning Academy) and help us leverage data to enhance teaching and...,Singapore Institute of Technology,Central Region,Science & Technology,"Mathematics, Statistics & Information Sciences",Contract/Temp,,2024-04-15T05:37:00Z,11d ago,https://www.jobstreet.com.sg/job/75137646
75436594,Automotive Engineer,Contribute to analytics forums and cross-functional groups by sharing learning within and beyond Global Battery Engineering and Automotive Engineer...,Lexbuild International Pte Ltd,West Region,Science & Technology,"Mathematics, Statistics & Information Sciences",Full time,,2024-04-26T05:54:00Z,6h ago,https://www.jobstreet.com.sg/job/75436594
75328142,Business Analyst (ETL/ Data Mapping),We are urgently hiring for a Business Analyst for one of our reputed banking client based in Singapore,JonDavidson Pte Ltd,Central Region,Information & Communication Technology,Database Development & Administration,Full time,,2024-04-22T12:39:08Z,3d ago,https://www.jobstreet.com.sg/job/75328142
75318588,Business Development (Data Analyst) Intern - Revenue Marketing Solutions,-,SHOPEE SINGAPORE PRIVATE LIMITED,Central Region,Sales,New Business Development,Full time,,2024-04-22T06:34:24Z,4d ago,https://www.jobstreet.com.sg/job/75318588
75407694,Data Analyst (QlikSense),"InfoCepts is a global leader of end-to-end data & analytics solutions with nearly 20 years of experience, also named as Gartner’s 2020, 2021 and 20...",InfoCepts Pte. Ltd.,East Region,Science & Technology,"Mathematics, Statistics & Information Sciences",Full time,,2024-04-25T06:22:00Z,1d ago,https://www.jobstreet.com.sg/job/75407694
