job_id,titles,teasers,companies,locations,categorys,subCategories,job_types,salaries,dateposted,datedisplay,url
75329643,AI Product Counsel,"About ByteDance ByteDance will be prioritizing applicants who have a current right to work in Singapore, and do not require ByteDance sponsorship o...",BYTEDANCE PTE. LTD.,Central Region,Education & Training,Research & Fellowships,Full time,,2024-04-22T13:04:00Z,3d ago,https://www.jobstreet.com.sg/job/75329643
75342681,"Senior Manager, New Ventures (Venture Building) - AI","We are looking for individual(s) experienced with AI project development/ implementation, to join us as a venture builder at a Senior Manager senio...",Public Service Division,Central Region,Sales,New Business Development,Full time,,2024-04-23T01:37:00Z,3d ago,https://www.jobstreet.com.sg/job/75342681
75329628,"AI Development Expert, Generative AI, SAP Singapore","As an AI Development Expert, you will work together with a team of dedicated experts including AI scientists, data engineers, dev-ops engineers, an...",SAP Asia Pte Ltd,Central Region,Information & Communication Technology,Team Leaders,Full time,,2024-04-22T11:49:00Z,4d ago,https://www.jobstreet.com.sg/job/75329628
75323298,Research Fellow for AI Singapore (Research),Research Fellow for AI Singapore (Research),National University of Singapore,Central Region,Education & Training,Other,Full time,,2024-04-22T09:15:15Z,4d ago,https://www.jobstreet.com.sg/job/75323298
75287932,AI Engineer (Remote),We are seeking a talented AI Engineer with expertise in LLMs on a 2 year contract basis to help in revolutionizing the way people interact with tec...,Tech In Asia,Central Region,Engineering,Electrical/Electronic Engineering,Contract/Temp,,2024-04-19T16:20:00Z,6d ago,https://www.jobstreet.com.sg/job/75287932
75293491,System Architect (AI Sub-system),Participate and lead in the system solution design of next generation multi-core multi-chip AI sub-system that scales beyond 1000s TOPS for high pe...,Renesas Electronics Singapore Pte. Ltd.,Central Region,Engineering,Electrical/Electronic Engineering,Full time,,2024-04-20T05:05:00Z,6d ago,https://www.jobstreet.com.sg/job/75293491
75293522,Hardware Architect (AI Sub-system),"We are seeking a talented and motivated Hardware Architect (AI Sub-system) to join our R&D team to own, define, and drive exploration and design of...",Renesas Electronics Singapore Pte. Ltd.,Central Region,Engineering,Electrical/Electronic Engineering,Full time,,2024-04-20T05:06:00Z,6d ago,https://www.jobstreet.com.sg/job/75293522
75276823,Product Operation Manager - AI/LLM Operation,"TikTok will be prioritizing applicants who have a current right to work in Singapore, and do not require TikTok sponsorship of a visa. TikTok is th...",TIKTOK PTE. LTD.,Central Region,Information & Communication Technology,Programme & Project Management,Full time,,2024-04-18T22:04:00Z,7d ago,https://www.jobstreet.com.sg/job/75276823
75287745,Senior Executive / Assistant Programme Manager for AI Singapore (Innovation),AI Singapore is sourcing for an individual to join the AI Innovation team as an Assistant Programme Manager / Senior Executive. The Assistant Progr...,Yale-NUS College,Central Region,Education & Training,Workplace Training & Assessment,Full time,,2024-04-19T16:15:00Z,6d ago,https://www.jobstreet.com.sg/job/75287745
75369823,Research Fellow (AI Finance),"- Experience of conducting interdisciplinary research. Relevant experience in international finance, public finance, and econometrics would be a pl...",Yale-NUS College,Central Region,Administration & Office Support,Administrative Assistants,Full time,,2024-04-18T12:00:00Z,7d ago,https://www.jobstreet.com.sg/job/75369823
75206960,Systems Engineer | AI-HPC,"- Be involved in complex architectural design and development of AI-HPC infrastructure.
- Ensures completeness and compatibility of the technical i...",NovaGlobal Pte Ltd,West Region,Information & Communication Technology,Architects,Full time,,2024-04-17T13:43:00Z,8d ago,https://www.jobstreet.com.sg/job/75206960
75198844,Gen AI Developer,Hiring Gen-AI Developer,Aquis Search Pte Ltd,Central Region,Information & Communication Technology,Engineering - Software,Contract/Temp,,2024-04-17T08:00:10Z,9d ago,https://www.jobstreet.com.sg/job/75198844
75239279,Product Manager (Content Safety) - AI Innovation Business,We are seeking a senior product manager with a focus on community safety. This role requires a deep understanding of industry and user needs to ens...,BYTEDANCE PTE. LTD.,Central Region,Marketing & Communications,Product Management & Development,Full time,,2024-04-18T14:53:00Z,7d ago,https://www.jobstreet.com.sg/job/75239279
75191081,Internship - Enhance Reports & Process via Automation AI,"Does this sound like just the right challenge for you? If so, we look forward to getting to know you!",Infineon Technologies,Central Region,Information & Communication Technology,Database Development & Administration,Contract/Temp,,2024-04-17T05:40:02Z,9d ago,https://www.jobstreet.com.sg/job/75191081
75196183,AI Engineer - Marketplace Intelligence and Data,-,SHOPEE SINGAPORE PRIVATE LIMITED,Central Region,Science & Technology,"Mathematics, Statistics & Information Sciences",Full time,,2024-04-17T06:48:24Z,9d ago,https://www.jobstreet.com.sg/job/75196183
75367439,Senior Executive / Assistant Programme Manager for AI Singapore (Innovation),AI Singapore is sourcing for an individual to join the AI Innovation team as an Assistant Programme Manager / Senior Executive. The Assistant Progr...,Yale-NUS College,Central Region,Education & Training,Workplace Training & Assessment,Full time,,2024-04-17T12:00:00Z,8d ago,https://www.jobstreet.com.sg/job/75367439
75185505,Principle Anti-Fraud AI Engineer - Search & Recommendation,-,SHOPEE SINGAPORE PRIVATE LIMITED,Central Region,Information & Communication Technology,Engineering - Software,Full time,,2024-04-17T02:56:28Z,9d ago,https://www.jobstreet.com.sg/job/75185505
75144816,Software Engineer (AI Sub-system),We are seeking a talented and motivated Software Engineer (AI Sub-system) to join our R&D team to support the exploration and design of our next ge...,Renesas Electronics Singapore Pte. Ltd.,Central Region,Engineering,Electrical/Electronic Engineering,Full time,,2024-04-15T19:21:00Z,10d ago,https://www.jobstreet.com.sg/job/75144816
75184763,Senior Executive / Assistant Programme Manager for AI Singapore (Innovation),Senior Executive / Assistant Programme Manager for AI Singapore (Innovation),National University of Singapore,Central Region,Education & Training,Other,Full time,,2024-04-17T02:35:40Z,9d ago,https://www.jobstreet.com.sg/job/75184763
75176050,Technology Sales Specialist - Data & AI,"A Technology Sales Specialist role (what we internally call a, ‘Brand Sales Specialist’) in IBM’s Data & AI brand means accelerating enterprises’ s...",IBM SERVICES TALENT DELIVERY PTE. LTD.,Central Region,Sales,Sales Representatives/Consultants,Full time,,2024-04-16T14:13:00Z,9d ago,https://www.jobstreet.com.sg/job/75176050
75202758,"Technology Sales - Brand Partner Specialist, Data & AI","Engaging directly with partners and their clients in support of high value engagements and opportunities, you will augment partner and client engag...",IBM SERVICES TALENT DELIVERY PTE. LTD.,Central Region,Sales,Account & Relationship Management,Full time,,2024-04-17T05:53:00Z,9d ago,https://www.jobstreet.com.sg/job/75202758
75167082,HR Officer – AI and Robotics Company,"About Us: We are a leading AI and robotics company at the forefront of technological innovation, dedicated to creating cutting-edge solutions that ...",DCONSTRUCT ROBOTICS PTE. LTD.,Central Region,Human Resources & Recruitment,Consulting & Generalist HR,Full time,,2024-04-16T07:45:00Z,10d ago,https://www.jobstreet.com.sg/job/75167082
75144875,AI compiler Engineer (AI Sub-system),"We are seeking a talented and motivated AI compiler Engineer (AI Sub-system) to join our R&D team to own, define, and drive exploration and design ...",Renesas Electronics Singapore Pte. Ltd.,Central Region,Engineering,Electrical/Electronic Engineering,Full time,,2024-04-15T19:21:00Z,10d ago,https://www.jobstreet.com.sg/job/75144875
75367969,Research Fellow for AI Singapore (Research),The programme office is hosted by the National University of Singapore (NUS) and brings together all Singapore-based research institutions and the ...,Yale-NUS College,Central Region,Education & Training,Research & Fellowships,Full time,,2024-04-15T12:00:00Z,10d ago,https://www.jobstreet.com.sg/job/75367969
75111616,"Manager/Assistant Manager, AI Office (2-year contract)",You support the CGH Artificial Intelligence and Digital (AID) Committee and CGH Chief Data and Digital Officer (CDDO) on administrative matters.,Changi General Hospital,East Region,Science & Technology,"Mathematics, Statistics & Information Sciences",Full time,,2024-04-14T09:37:42Z,12d ago,https://www.jobstreet.com.sg/job/75111616
75133185,Senior AI Engineer (Technical Documentation and Community Engagement) (Products),Senior AI Engineer (Technical Documentation and Community Engagement) for AI Singapore (Products),National University of Singapore,Central Region,Education & Training,Other,Full time,,2024-04-15T07:55:20Z,11d ago,https://www.jobstreet.com.sg/job/75133185
75109324,"Field Engineering, Generative AI Product Specialist","You have expertise in Data Science, Machine Learning, Generative AI, NLP and Computer Vision and expertise in using PySpark and SQL. You will excel...",Databricks,Central Region,Information & Communication Technology,Product Management & Development,Full time,,2024-04-13T18:59:00Z,12d ago,https://www.jobstreet.com.sg/job/75109324
75102085,Lead AI Engineer,This role will play a critical part in the Data Science workstream within the Analytics Centre of Excellence (CoE). The role is responsible for pro...,Prudential (WM Group- Linda Quah),Central Region,Science & Technology,"Mathematics, Statistics & Information Sciences",Full time,,2024-04-12T15:32:00Z,13d ago,https://www.jobstreet.com.sg/job/75102085
75430355,Senior Vision Software Engineer - WT,"As a Senior Vision Software Engineer, you must be strong in C / C++ to handle the vision machine",Dynamic Human Capital Pte Ltd,North Region,Information & Communication Technology,Developers/Programmers,Full time,"$5,000 – $7,000 per month",2024-04-26T06:56:01Z,5h ago,https://www.jobstreet.com.sg/job/75430355
75426902,Software Engineer (Vision),"- Major Manufacturing MNC in Singapore
- Newly Created role
- Key Innovation Role",Hudson Global Resources ( HQ ),Central Region,Information & Communication Technology,Engineering - Software,Full time,,2024-04-26T05:11:40Z,6h ago,https://www.jobstreet.com.sg/job/75426902
75328315,Software Engineer / Automated Vision Equipment / Kallang,Carry out Research & Development in Image Processing / Computer Vision Algorithm for automated optical inspection systems,WORKSTONE PTE. LTD.,East Region,Information & Communication Technology,Engineering - Software,Full time,"$4,500 – $6,000 per month",2024-04-22T13:40:39Z,3d ago,https://www.jobstreet.com.sg/job/75328315
75105797,Full-stack Software Developer for AI Chatbot Startup,We're looking for talented and motivated junior to mid-level software engineers who are looking to challenge and improve themselves while building ...,BotDistrikt,Central Region,Information & Communication Technology,Developers/Programmers,Full time,,2024-04-13T01:14:00Z,13d ago,https://www.jobstreet.com.sg/job/75105797
75396816,Research Engineer (Machine Learning),Research Engineer (Machine Learning),National University of Singapore,Central Region,Education & Training,Other,Full time,,2024-04-25T00:55:24Z,1d ago,https://www.jobstreet.com.sg/job/75396816
75101324,AI/ML Architect,"Join our rapidly expanding Research & Development team, where we lead the exploration, adaptation, and implementation of the latest advancements in...",Section Pte. Ltd.,Central Region,Information & Communication Technology,Architects,Full time,,2024-04-12T15:43:00Z,13d ago,https://www.jobstreet.com.sg/job/75101324
75050050,AI Software Engineer,Pensees R&D team is searching for an outstanding software engineer to build the AIGC framework of the future. Join us in developing the AIGC platfo...,Pensees Pte Ltd,Central Region,Information & Communication Technology,Developers/Programmers,Full time,,2024-04-10T16:40:00Z,15d ago,https://www.jobstreet.com.sg/job/75050050
75078616,Professional Officer (All Levels) in (Generative AI) (SPICE),-,Singapore Institute of Technology,North-East Region,Information & Communication Technology,Developers/Programmers,Contract/Temp,,2024-04-12T01:12:29Z,14d ago,https://www.jobstreet.com.sg/job/75078616
75097792,Solution Architect - Data & AI,We are seeking a highly skilled and experienced Solution Architect – Data Analytics for AWS to join our team and play a crucial role in designing a...,SoftwareONE Pte Ltd,Central Region,Science & Technology,"Mathematics, Statistics & Information Sciences",Full time,,2024-04-12T10:34:00Z,14d ago,https://www.jobstreet.com.sg/job/75097792
75030117,Machine Learning Engineer (Architect) - Applied AI,"TikTok is the leading destination for short-form mobile video. At TikTok, our mission is to inspire creativity and bring joy. TikTok's global headq...",TIKTOK PTE. LTD.,Central Region,Science & Technology,"Mathematics, Statistics & Information Sciences",Full time,,2024-04-09T16:26:00Z,16d ago,https://www.jobstreet.com.sg/job/75030117
74184604,"Software Deployment and Integration Engineer, Artificial Intelligence",-,ST Engineering Ltd,West Region,Information & Communication Technology,Other,Full time,,2024-04-26T09:16:23Z,2h ago,https://www.jobstreet.com.sg/job/74184604
75394871,IT Software Engineer,"Person we are looking for must be able to work independently, proactive and manage projects assigned to them with minimum supervision. Selected per...",Automatic Controls And Instrumentation Pte Ltd,Central Region,Information & Communication Technology,Developers/Programmers,Full time,,2024-04-24T18:09:00Z,1d ago,https://www.jobstreet.com.sg/job/75394871
75370048,Senior Engineer/Tech Lead for AI Singapore (AI Products),"The Senior Engineer/Tech Lead will be expected to provide technical leadership, drive collaboration with cross-functional teams within AI Products ...",Yale-NUS College,Central Region,Information & Communication Technology,Programme & Project Management,Full time,,2024-04-11T12:00:00Z,14d ago,https://www.jobstreet.com.sg/job/75370048
75369123,Natural Language Processing Engineer for AI Singapore (Products),"We are looking for an AI Engineer to perform development and engineering work for NLP products under AI Singapore.
Duties & Responsibilities
● Deve...",Yale-NUS College,Central Region,Education & Training,Research & Fellowships,Full time,,2024-04-10T12:00:00Z,15d ago,https://www.jobstreet.com.sg/job/75369123
75063869,Postdoctoral Associate / Research Scientist (Designing human-AI teams) (CS),The M3S programme aims to promote the use of AI and machines for practical applications through an intersectional approach.,Singapore-MIT Alliance for Research and Technology Centre,Central Region,Science & Technology,Biotechnology & Genetics,Full time,,2024-04-11T06:28:27Z,15d ago,https://www.jobstreet.com.sg/job/75063869
75048739,Data Engineer - Applied AI,"TikTok is the leading destination for short-form mobile video. At TikTok, our mission is to inspire creativity and bring joy. TikTok's global headq...",TIKTOK PTE. LTD.,Central Region,Science & Technology,"Mathematics, Statistics & Information Sciences",Full time,,2024-04-10T06:53:00Z,16d ago,https://www.jobstreet.com.sg/job/75048739
75368553,Senior Research Fellow (AI & Tech),"Applications are invited for a Senior Research Fellow position in the Centre for International Law (CIL), National University of Singapore. This is...",Yale-NUS College,Central Region,Education & Training,Teaching - Tertiary,Full time,,2024-04-10T12:00:00Z,15d ago,https://www.jobstreet.com.sg/job/75368553
75064370,Research Engineer (Designing human-AI teams) (CS),The M3S programme aims to promote the use of AI and machines for practical applications through an intersectional approach.,Singapore-MIT Alliance for Research and Technology Centre,Central Region,Engineering,Other,Full time,,2024-04-11T06:32:38Z,15d ago,https://www.jobstreet.com.sg/job/75064370
75064209,Postdoctoral Associate / Research Scientist (Designing human-AI teams) (SS),The M3S programme aims to promote the use of AI and machines for practical applications through an intersectional approach.,Singapore-MIT Alliance for Research and Technology Centre,Central Region,Science & Technology,Biotechnology & Genetics,Full time,,2024-04-11T06:31:12Z,15d ago,https://www.jobstreet.com.sg/job/75064209
75064510,Research Engineer (Designing human-AI teams) (SS),The M3S programme aims to promote the use of AI and machines for practical applications through an intersectional approach.,Singapore-MIT Alliance for Research and Technology Centre,Central Region,Science & Technology,Other,Full time,,2024-04-11T06:34:00Z,15d ago,https://www.jobstreet.com.sg/job/75064510
75368124,Programme Manager for AI Singapore,AI Singapore is sourcing for an individual to join the Core team as a Programme Manager. The Programme Manager will assist the Director of Planning...,Yale-NUS College,Central Region,Administration & Office Support,Office Management,Full time,,2024-04-09T12:00:00Z,16d ago,https://www.jobstreet.com.sg/job/75368124
75002826,AI Software Engineer,"At least 2 years of Experience in developing Vision AI applications, i.e. object detection & classification, object segmentation, computer vision a...",CYNAPSE PTE. LTD.,Central Region,Information & Communication Technology,Architects,Full time,,2024-04-08T12:37:00Z,17d ago,https://www.jobstreet.com.sg/job/75002826
75367775,Associate Professor (Engineering Systems and Design Pillar),"The Singapore University of Technology and Design (SUTD) has topped the list of emerging engineering schools (MIT report, 2018) and possesses a uni...",SUTD (Singapore University of Technology & Design),Central Region,Engineering,Management,Contract/Temp,,2024-04-23T13:48:00Z,2d ago,https://www.jobstreet.com.sg/job/75367775
75375244,"Senior Software Engineer, Data Quality Engineering, Google Geo","Google's software engineers develop the next-generation technologies that change how billions of users connect, explore, and interact with informat...",Google Inc.,Central Region,Science & Technology,"Mathematics, Statistics & Information Sciences",Full time,,2024-04-23T01:45:00Z,3d ago,https://www.jobstreet.com.sg/job/75375244
75023897,"Director, Product Management (AI)","Develop and drive the product vision, strategy, and roadmap for AI-driven products in the cryptocurrency and blockchain industry.
Conduct in-depth ...",Crypto,Central Region,Marketing & Communications,Product Management & Development,Full time,,2024-04-09T06:20:00Z,17d ago,https://www.jobstreet.com.sg/job/75023897
75381104,"Research Engineer (1-year contract), SCIS","Minimum one year of relevant research experience in deep learning or operations research
Proficiency in programming languages such as Python is req...",Singapore Management University,Central Region,Education & Training,Research & Fellowships,Contract/Temp,,2024-04-24T04:38:00Z,2d ago,https://www.jobstreet.com.sg/job/75381104
75017244,Platforms Engineer (MLOps) for AI Singapore,Platforms Engineer (MLOps) for AI Singapore,National University of Singapore,Central Region,Education & Training,Other,Full time,,2024-04-09T05:15:58Z,17d ago,https://www.jobstreet.com.sg/job/75017244
74992913,Solution Architect - Data & AI - Industry Solutions,"The D&AI Solution Architect works with customer to deliver high ROI solutions with a focus on modern data platforms, analytics, machine learning & ...",Microsoft,Central Region,Information & Communication Technology,Architects,Full time,,2024-04-07T03:36:00Z,19d ago,https://www.jobstreet.com.sg/job/74992913
75369424,Research Fellow (AI Ethics in Healthcare),The Centre for Biomedical Ethics (CBmE) was established in September 2006 in the Yong Loo Lin School of Medicine through a generous gift by the Che...,Yale-NUS College,Central Region,Education & Training,Research & Fellowships,Full time,,2024-04-07T12:00:00Z,18d ago,https://www.jobstreet.com.sg/job/75369424
75368320,Research Assistant / Research Associate in AI and Machine Learning,We are seeking a Research Assistant / Research Associate with a strong background in AI and machine learning to join our dynamic team. Successful c...,Yale-NUS College,Central Region,Science & Technology,"Mathematics, Statistics & Information Sciences",Full time,,2024-04-06T12:00:00Z,19d ago,https://www.jobstreet.com.sg/job/75368320
74931503,AI Engineer,"Support the production of scalable and optimised AI or machine learning (ML) models.
Focus on building algorithms for the extraction, transformatio...",ANTCHAIN TECHNOLOGY PTE. LTD.,West Region,Science & Technology,"Mathematics, Statistics & Information Sciences",Full time,,2024-04-04T12:08:00Z,21d ago,https://www.jobstreet.com.sg/job/74931503
75238013,Algorithm engineer ecommerce knowledge,"TikTok will be prioritizing applicants who have a current right to work in Singapore, and do not require TikTok's sponsorship of a visa. TikTok is ...",TIKTOK PTE. LTD.,Central Region,Science & Technology,"Mathematics, Statistics & Information Sciences",Full time,,2024-04-18T12:46:00Z,7d ago,https://www.jobstreet.com.sg/job/75238013
75375587,Professional Officer (All Levels) in Diagnostic Radiography,-,Singapore Institute of Technology,Central Region,Healthcare & Medical,Medical Imaging,Contract/Temp,,2024-04-24T03:57:48Z,2d ago,https://www.jobstreet.com.sg/job/75375587
74969866,Robotics Researcher - AI and Robotics Company,"About Us: We are a leading AI and robotics company at the forefront of technological innovation, dedicated to creating cutting-edge solutions that ...",DCONSTRUCT ROBOTICS PTE. LTD.,Central Region,Education & Training,Research & Fellowships,Full time,,2024-04-05T23:31:00Z,20d ago,https://www.jobstreet.com.sg/job/74969866
75331528,Video Analytics System Support,"6. The System Support shall have experience in VA or similar project management.
7. Experience in VA system management or equivalent role.
8. Exper...",MTS SYSTEMS ENGINEERING PTE. LTD.,Central Region,Engineering,Electrical/Electronic Engineering,Full time,,2024-04-22T14:13:00Z,3d ago,https://www.jobstreet.com.sg/job/75331528
74931682,AI Researcher,"Identify and develop core data and AI science components for the delivery of projects, architect specialised database and computing environments, e...",ANTCHAIN TECHNOLOGY PTE. LTD.,West Region,Science & Technology,"Mathematics, Statistics & Information Sciences",Full time,,2024-04-04T12:08:00Z,21d ago,https://www.jobstreet.com.sg/job/74931682
75270563,Identity Verification (KYC) Algorithm Engineer - Marketplace Intelligence & Data,-,SHOPEE SINGAPORE PRIVATE LIMITED,Singapore,Information & Communication Technology,Engineering - Software,Full time,,2024-04-19T07:00:22Z,7d ago,https://www.jobstreet.com.sg/job/75270563
74969889,Hardware Engineer - AI and Robotics Company,"About Us: We are a leading AI and robotics company at the forefront of technological innovation, dedicated to creating cutting-edge solutions that ...",DCONSTRUCT ROBOTICS PTE. LTD.,Central Region,Engineering,Electrical/Electronic Engineering,Full time,,2024-04-05T23:32:00Z,20d ago,https://www.jobstreet.com.sg/job/74969889
74942894,Generative AI Engineer - J44192,Generative AI Engineer with keen interest in nation-wide initiatives.,ScienTec Consulting Pte Ltd,Central Region,Information & Communication Technology,Developers/Programmers,Full time,,2024-04-05T03:04:03Z,21d ago,https://www.jobstreet.com.sg/job/74942894
74970088,Tech Trainer - AI and Robotics Company,Job Description: We are looking for an enthusiastic Technical Trainer to educate people in the technological field of AI and Robotics. You will dev...,DCONSTRUCT ROBOTICS PTE. LTD.,Central Region,Education & Training,Workplace Training & Assessment,Full time,,2024-04-05T23:33:00Z,20d ago,https://www.jobstreet.com.sg/job/74970088
75270135,Algorithm Engineer - Search & Recommendation (Campus Recruitment 2024),-,SHOPEE SINGAPORE PRIVATE LIMITED,Central Region,Information & Communication Technology,Engineering - Software,Full time,,2024-04-19T06:51:45Z,7d ago,https://www.jobstreet.com.sg/job/75270135
74970386,Finance Manager - AI and Robotics Company,"About Us: We are a leading AI and robotics company at the forefront of technological innovation, dedicated to creating cutting-edge solutions that ...",DCONSTRUCT ROBOTICS PTE. LTD.,Central Region,Accounting,Financial Accounting & Reporting,Full time,,2024-04-05T23:31:00Z,20d ago,https://www.jobstreet.com.sg/job/74970386
74961510,Senior AI Engineer/Scientist,We are looking for candidates to fulfil a role in AI Team as Engineer/ Senior Engineer. He/ She will be part of a dynamic team involved in deployin...,Hendricks Corp,North-East Region,Information & Communication Technology,Engineering - Software,Full time,,2024-04-05T08:44:00Z,21d ago,https://www.jobstreet.com.sg/job/74961510
75197939,Senior Machine learning Platform Engineer - Paid Ads,-,SHOPEE SINGAPORE PRIVATE LIMITED,Central Region,Information & Communication Technology,Developers/Programmers,Full time,,2024-04-17T07:24:57Z,9d ago,https://www.jobstreet.com.sg/job/75197939
74938422,Senior AI or AI Software Engineer,Pensees R&D team is searching for an outstanding software engineer to build the AIGC framework of the future. Join us in developing the AIGC platfo...,Pensees Pte Ltd,Central Region,Information & Communication Technology,Developers/Programmers,Full time,,2024-04-04T21:00:00Z,21d ago,https://www.jobstreet.com.sg/job/74938422
